TRANSACTION_ID,CUST_ID,AMOUNT,TRANSACTION_TYPE,TRANSACTION_DATE,DESCRIPTION
1,6523,3030.41,Refund,2023-11-16,Ask child owner image.
2,1321,7557.81,Credit,2024-11-12,Control effect attack it.
3,1407,8078.73,Transfer,2023-02-19,Less base opportunity character despite.
4,8571,8826.4,Withdrawal,2021-09-08,Hot push street begin and build.
5,1403,1752.69,Credit,2020-09-09,Model set hour hospital year.
6,395,8844.14,Deposit,2020-09-26,Public fact material yet.
7,2985,4629.86,Deposit,2021-12-31,Major water nearly remain.
8,3984,8657.31,Debit,2021-07-31,Run situation society among contain stage daughter color.
9,4032,8972.13,Deposit,2025-06-26,Interview medical area both suddenly radio brother discussion.
10,7735,686.46,Deposit,2021-05-05,List chair large support on plant head many.
11,8795,8831.85,Transfer,2021-02-23,Relationship back wind.
12,7348,1375.9,Withdrawal,2023-05-24,Key where social various position item.
13,5259,5869.71,Deposit,2021-11-11,Air them necessary only.
14,34,9985.08,Withdrawal,2022-01-07,Carry agent seven argue chair place so peace.
15,9989,6428.32,Debit,2021-05-28,Size reduce pass season security crime power.
16,2302,8084.29,Transfer,2023-02-04,Little deep either become child focus.
17,6927,8514.75,Deposit,2021-01-20,Use choose head box.
18,3146,8678.96,Debit,2021-11-26,Mention however throughout middle course generation police above.
19,9251,3285.26,Transfer,2023-08-16,Parent stay soon yet nature film.
20,1083,8715.36,Withdrawal,2025-03-30,Skin already arm imagine whether PM evening will.
21,9266,4116.46,Withdrawal,2023-04-21,Under husband hold spend nearly.
22,6137,7088.9,Transfer,2025-06-05,Country air responsibility without.
23,9807,2350.15,Debit,2021-07-28,Toward station team within however knowledge good.
24,4074,1014.59,Withdrawal,2021-07-21,Heavy glass over receive old use surface south.
25,2707,8382.59,Withdrawal,2024-04-03,Probably along seat clear like.
26,1933,2893.28,Debit,2025-01-27,Continue board all myself note common anything.
27,4258,7704.98,Transfer,2021-09-13,Financial others rather the treatment race.
28,3858,2938.84,Deposit,2023-03-20,Live near size knowledge term.
29,4814,8246.38,Credit,2021-04-07,Possible by measure describe exactly create nice.
30,7513,749.53,Deposit,2024-04-05,Various deal write administration plan.
31,5125,3917.2,Withdrawal,2024-11-13,Others station suddenly now outside.
32,782,1112.45,Withdrawal,2022-12-17,History skin war wish.
33,2229,1840.73,Withdrawal,2022-06-18,Tend participant per.
34,8900,8587.79,Credit,2025-07-18,Minute voice send attack.
35,3153,7975.84,Transfer,2024-07-22,Why gas thank whether say teach.
36,5555,1881.16,Withdrawal,2025-03-08,Base summer necessary memory outside.
37,5568,1868.87,Withdrawal,2023-11-05,Some provide within top another born keep.
38,3737,9210.38,Refund,2024-02-26,Investment same level probably tend.
39,3013,6901.34,Refund,2021-12-18,Watch small industry author shoulder law month everybody.
40,2153,8210.56,Credit,2021-04-11,Before mind include heavy.
41,5015,2253.59,Credit,2022-04-05,Team listen various first property.
42,2792,4944.86,Deposit,2024-01-26,Method agreement campaign bad.
43,3054,9430.62,Debit,2024-03-08,Attorney between civil table.
44,818,1410.2,Credit,2021-06-20,Day sometimes marriage by degree yourself less.
45,6759,1326.18,Withdrawal,2024-09-08,Clearly quickly tree present race several.
46,7084,9393.36,Credit,2024-05-29,Fly throughout end hundred low I actually.
47,3106,2154.26,Withdrawal,2024-06-01,Act store security hope realize Mrs.
48,9744,2440.27,Transfer,2025-02-09,Threat name present along.
49,3298,6308.11,Credit,2025-07-27,Lose here black member.
50,2229,9583.38,Refund,2024-08-01,Free blue event purpose vote during.
51,2110,9383.58,Deposit,2020-08-09,Garden maintain believe example.
52,6575,4913.85,Withdrawal,2023-06-18,Research arrive necessary tax establish.
53,9497,4091.37,Refund,2023-12-12,Traditional those growth series.
54,9205,8778.78,Debit,2020-12-14,We thank as.
55,1552,2489.14,Debit,2025-05-17,Whose various plant its wrong.
56,1512,7382.78,Withdrawal,2023-01-27,Take involve believe old page give continue.
57,8286,1129.03,Transfer,2021-05-27,Economic news account note among should.
58,5385,5478.43,Deposit,2023-05-12,Morning speak no amount thousand.
59,4166,1108.49,Transfer,2022-10-06,Trial us hard city.
60,7336,3508.08,Debit,2020-11-17,Discuss own quite couple.
61,6006,8475.33,Transfer,2024-11-03,Employee human bar course study spring apply.
62,2410,5246.7,Debit,2021-05-24,Score certainly soldier foreign beat pass new.
63,7451,4633.54,Transfer,2022-12-19,Travel medical federal eye about kid.
64,2645,4874.37,Deposit,2023-12-26,Employee direction various center laugh.
65,7529,3131.94,Debit,2021-08-20,Management identify smile exist wish movement.
66,4062,2342.38,Debit,2024-05-19,Think enter any defense factor subject heavy.
67,1057,7554.35,Refund,2020-08-16,Compare authority deal every yeah story song environmental.
68,3783,3939.83,Credit,2024-09-28,Model heavy prepare goal.
69,2899,6532.38,Deposit,2024-04-03,Western drop family ten player.
70,4232,5808.77,Refund,2023-02-01,Light hand approach cut five number.
71,3269,3745.13,Refund,2024-08-07,Easy skin society learn.
72,4250,5152.23,Transfer,2021-12-20,Decide open war family catch political.
73,9738,473.88,Withdrawal,2022-07-11,Worry history clear thousand price.
74,618,5692.26,Deposit,2025-02-12,Forget rule plant resource.
75,9299,9107.73,Withdrawal,2023-07-24,Article summer whose force woman.
76,4018,8068.19,Withdrawal,2021-09-30,This allow still here floor.
77,8582,5055.14,Credit,2021-02-20,Create project picture couple.
78,9056,8708.48,Deposit,2022-03-24,Particularly finally act fund.
79,5015,9151.12,Deposit,2024-10-03,Want interview treatment or side.
80,7984,1239.48,Credit,2021-04-13,Man quality school out save.
81,8616,8625.7,Withdrawal,2025-05-15,Minute Mrs every attention.
82,7117,5281.05,Deposit,2022-02-08,Few whom seek low.
83,2869,8162.15,Transfer,2021-05-28,Agreement coach lot start our sound from.
84,9179,8007.32,Debit,2021-02-26,Heavy firm style suffer audience someone paper land.
85,4883,2457.92,Withdrawal,2021-04-16,Front see do education paper seat parent.
86,6460,5473.98,Refund,2022-08-15,Society perform bad window center small.
87,7689,5481.12,Refund,2023-10-24,Different community bag herself.
88,1045,7767.82,Transfer,2024-04-01,Above training painting part if job.
89,6451,9752.36,Deposit,2025-01-24,Current responsibility room do.
90,2179,4388.97,Refund,2024-02-23,Stock career establish strategy.
91,7540,7362.56,Refund,2024-03-22,Kind arm former open cell respond.
92,8313,5727.49,Withdrawal,2023-05-13,Place ten camera share boy staff.
93,307,2316.27,Credit,2023-09-19,Thousand alone network person teach low laugh.
94,1008,7862.62,Transfer,2021-11-17,Recognize company receive herself.
95,8899,2612.46,Withdrawal,2024-06-07,See actually wide successful.
96,6279,9608.21,Withdrawal,2022-12-04,Computer to us fire common finish window.
97,8426,3948.92,Deposit,2023-08-28,Various industry record tonight and.
98,897,1480.62,Credit,2025-06-08,Most class store I.
99,6758,2045.08,Debit,2023-12-11,Upon become bed race minute identify better summer.
100,6342,6096.77,Credit,2024-10-21,Full here develop cold couple one keep.
101,5862,5359.9,Debit,2021-01-05,Individual believe yet many spring season wrong.
102,3578,3259.28,Credit,2023-03-22,Seem simply word view sing successful.
103,3776,3522.95,Withdrawal,2025-01-13,Medical while sort wonder.
104,4101,4060.28,Refund,2024-07-02,Sit expert discuss along.
105,249,5089.63,Deposit,2023-09-14,Turn child hotel quite five.
106,4511,680.79,Debit,2021-06-17,Bad member make mouth.
107,9188,5871.15,Deposit,2021-08-09,Easy after film public worker.
108,4139,415.41,Deposit,2024-12-19,Change reality read sit street few entire.
109,3393,5273.42,Deposit,2022-05-02,Need nice speech employee fill upon mother.
110,1604,5821.9,Deposit,2022-04-20,Yes scene short wide woman.
111,8532,6353.55,Withdrawal,2023-07-07,Career however power media.
112,393,1640.54,Credit,2024-07-21,Day determine cultural trade management program rate.
113,5833,9489.04,Debit,2023-05-02,Condition each political move degree pay.
114,4385,9493.44,Refund,2024-01-04,Good cost wait property visit need develop.
115,8645,244.91,Withdrawal,2022-07-25,Sound pretty hold game situation team.
116,2595,4732.38,Deposit,2023-11-08,Than increase big seek film western last.
117,425,1732.52,Credit,2022-09-07,She same open region write suggest save.
118,347,4270.29,Deposit,2021-03-03,Lot speech value court.
119,3268,8065.47,Transfer,2023-09-18,Wonder professional through table partner leg reason right.
120,1530,5661.66,Refund,2023-08-24,Happy feel end know.
121,6699,6978.96,Deposit,2020-11-13,Almost long record manage first.
122,4775,8354.42,Deposit,2020-09-03,Table get professional out table meet.
123,5780,6854.52,Transfer,2022-09-12,Realize establish full often source like.
124,1365,9103.18,Credit,2024-05-25,Test age range one interview tell.
125,4550,6986.43,Withdrawal,2021-05-25,Minute weight measure although according instead prevent three.
126,449,98.55,Deposit,2025-04-20,Particularly begin pass worry contain.
127,8140,885.31,Transfer,2023-10-30,Reach really increase space fine.
128,5499,5869.65,Deposit,2022-09-03,Realize none hard join where.
129,7003,8603.32,Withdrawal,2023-03-09,Machine father factor north industry memory conference.
130,1713,379.37,Credit,2022-07-21,Much factor exist really listen person law major.
131,804,2183.17,Debit,2025-07-27,Strategy particular hard economic shake health car from.
132,2064,9957.63,Credit,2024-11-07,Yes similar happen central model.
133,3127,7046.67,Deposit,2024-12-16,Network put new agency police middle.
134,2518,2730.99,Withdrawal,2024-10-22,Center choose green mother international military resource return.
135,6744,4556.05,Withdrawal,2022-03-03,Central according nothing conference.
136,9829,3726.34,Debit,2024-04-17,Toward firm whether plant me arrive between.
137,7008,1833.7,Debit,2023-11-29,Worry beyond watch senior claim officer.
138,2790,9718.59,Withdrawal,2024-09-24,News marriage see attorney big summer.
139,9302,3435.24,Deposit,2020-11-01,Mean successful item accept term usually process.
140,2822,4214.35,Deposit,2022-04-09,Religious foot thank case responsibility cut its.
141,2653,8076.86,Deposit,2024-12-20,Account practice writer measure get much rest watch.
142,2225,5963.7,Transfer,2024-04-07,Film fish wall though off.
143,8006,6662.0,Deposit,2025-04-01,Raise continue trial hope box.
144,4447,1326.57,Transfer,2024-03-02,Full where fast often share commercial.
145,1901,7496.48,Debit,2023-10-07,Debate forward apply might boy to with.
146,3019,5411.94,Deposit,2022-02-22,Black system skill issue few include.
147,2793,7486.78,Credit,2022-10-01,Above natural garden.
148,3552,3659.97,Credit,2021-11-09,Three these establish finish still central maybe.
149,9956,8318.78,Deposit,2025-01-09,Threat lose style black police factor course.
150,1514,6771.42,Withdrawal,2021-03-05,Main month age course.
151,8509,8321.75,Debit,2024-08-14,Health would power sister account.
152,7947,101.34,Credit,2021-12-05,Collection impact determine.
153,1455,648.69,Debit,2023-01-27,Charge but toward front least.
154,5355,8402.47,Debit,2021-05-21,Maybe everybody develop society decade consider behavior.
155,4216,7064.01,Credit,2025-03-15,Present coach deep value movement event pick create.
156,4085,1832.75,Deposit,2021-04-14,Wait under center want opportunity while.
157,5183,251.9,Debit,2020-08-09,Six second deal wonder lay box identify.
158,5773,2592.38,Refund,2023-07-20,Tend half college not Mrs nor will.
159,2341,5443.38,Credit,2024-06-22,Take bring sound need night cold total.
160,9552,7143.57,Transfer,2024-04-15,Whom thousand month edge race special while.
161,7121,1243.53,Transfer,2021-11-03,Can each another little whose.
162,9495,6227.28,Transfer,2021-11-14,Great measure how inside friend indicate focus.
163,2887,2594.9,Refund,2022-02-22,Free idea response short nearly within.
164,2846,9412.54,Credit,2024-03-20,Kid civil management site start able step.
165,7530,3391.64,Transfer,2023-10-08,At treatment single.
166,8735,7017.5,Transfer,2025-03-16,Sister themselves plant front.
167,759,2626.09,Refund,2022-11-26,Adult under talk huge several its side.
168,7819,509.72,Refund,2021-08-16,Grow wide everybody fast.
169,8677,3692.99,Credit,2023-02-21,Ten language black keep can grow describe explain.
170,5308,3635.32,Deposit,2024-10-17,Authority lose own character truth wrong scene class.
171,2507,1309.2,Deposit,2025-03-21,Laugh as within pass.
172,2011,7070.1,Withdrawal,2020-12-07,Between method none company laugh boy color.
173,6904,373.26,Deposit,2021-05-25,Phone unit tend paper lawyer fine expert.
174,4003,9060.3,Withdrawal,2025-05-12,Television around stay.
175,1524,6725.2,Debit,2023-01-01,Social wait lead soon than writer push.
176,6109,74.02,Debit,2021-10-20,Player economic under maintain.
177,3378,3844.39,Withdrawal,2020-12-07,When page too easy PM billion agency.
178,8548,1966.76,Withdrawal,2023-03-10,Rule true point thing thought tough move.
179,2795,926.79,Deposit,2025-07-06,Degree very way laugh stay assume any day.
180,280,9058.05,Refund,2021-03-21,Garden all rock road.
181,8316,4821.66,Transfer,2024-09-17,Inside test computer finally determine.
182,7346,5672.17,Debit,2022-03-03,Fish movement likely economic drug much interest.
183,4610,9486.63,Transfer,2022-08-04,Civil huge already happy vote particularly billion.
184,620,3706.14,Refund,2023-05-14,Send door fight road.
185,4654,5178.99,Refund,2021-08-28,Participant pressure along up write from.
186,4600,9983.15,Credit,2024-03-20,Team example item beyond church.
187,8511,1474.15,Refund,2021-11-04,Carry have series continue question top another deep.
188,6201,1873.34,Credit,2023-01-02,Also him allow eat call at.
189,3215,1905.66,Deposit,2023-03-24,Peace technology soldier interview.
190,9658,1235.04,Credit,2021-12-26,Seem ready certainly ball.
191,1192,6137.79,Credit,2023-11-28,Skill character that institution.
192,3964,7327.94,Credit,2021-03-21,Scene present dark gun situation.
193,4368,9052.88,Debit,2021-11-10,Fire spring best.
194,7612,6092.29,Debit,2022-03-04,Draw financial against stage agent.
195,1028,4574.83,Refund,2024-02-11,Specific practice event appear nothing pull.
196,552,7786.84,Refund,2025-06-08,Concern across network clearly eight wide current hotel.
197,4252,6333.97,Debit,2021-06-20,Necessary soldier raise continue form.
198,8172,3273.71,Credit,2023-05-21,Seek hand share action school.
199,5848,289.7,Transfer,2023-03-21,Cell ten agent doctor anyone ten.
200,2767,5990.27,Credit,2023-06-15,Billion others position develop.
201,3904,866.5,Transfer,2024-03-10,Thank ahead soon just present election simply.
202,2506,5769.92,Debit,2023-06-30,News including all often might music would.
203,4204,9721.63,Debit,2022-11-10,Add report far carry true site.
204,3336,9850.01,Credit,2022-12-13,Evening single detail news item.
205,5038,9394.22,Deposit,2023-04-02,Eat draw fire boy.
206,5676,2706.58,Deposit,2021-03-20,Rock center almost every.
207,1159,5500.36,Withdrawal,2022-06-29,Miss carry Republican significant.
208,6691,7731.74,Credit,2023-12-02,Walk himself structure here some huge.
209,5060,4880.72,Credit,2020-09-29,Dark safe beautiful cause commercial here similar.
210,584,5659.45,Refund,2023-11-24,Pick on check as need music instead.
211,2290,4393.81,Transfer,2022-08-27,White above in up.
212,2710,7744.79,Deposit,2024-02-18,Watch yeah house live read study rate.
213,2890,842.84,Deposit,2024-06-14,Business plan where six.
214,4524,921.21,Transfer,2023-01-16,Either here move old base television person.
215,620,5371.49,Withdrawal,2020-10-29,Many sit discussion management nor.
216,9199,4232.6,Withdrawal,2021-05-14,Side young dream story.
217,9077,54.01,Transfer,2020-09-29,Million operation public writer ever.
218,5126,4282.58,Deposit,2021-05-18,Hour say thus probably writer push.
219,6900,8526.14,Withdrawal,2023-04-21,Hotel paper down training pass.
220,912,5053.08,Refund,2023-07-11,According campaign though past.
221,4565,3205.69,Deposit,2024-12-12,Song sit stuff could through media make.
222,7641,5323.83,Credit,2021-04-03,Drive TV somebody type their this.
223,5369,4575.19,Debit,2024-09-27,Professional national window writer agree person.
224,1101,7776.0,Withdrawal,2023-01-24,Single people draw wind history security everyone.
225,9318,6633.96,Transfer,2021-03-08,Appear view item would car.
226,6346,3485.76,Debit,2025-05-20,Tv its significant professor station name share treatment.
227,2877,9845.07,Refund,2021-02-23,Walk trade avoid pass wear task.
228,4136,3694.89,Debit,2024-04-20,Treatment time father during.
229,2165,3406.66,Transfer,2025-06-08,Center budget about stage opportunity wife.
230,9648,3023.03,Refund,2024-12-13,Yet one health foot professor project.
231,7581,6331.06,Credit,2021-05-31,Medical mission join top gas everybody bank.
232,6133,228.86,Transfer,2023-04-03,World major official worker often us marriage.
233,6008,2811.65,Withdrawal,2023-03-26,Seem side off involve.
234,2643,9620.58,Deposit,2024-08-07,Leader tend where every care writer make.
235,526,2787.4,Credit,2025-05-12,Professional end few step direction able hair.
236,3819,1389.97,Transfer,2021-12-02,Nation evidence special growth once care wish.
237,7946,5663.31,Deposit,2023-08-05,Meet better white.
238,8021,2268.08,Debit,2025-01-24,Important song animal.
239,3986,9608.34,Credit,2021-09-17,Road run break relationship fact state.
240,3666,3726.66,Transfer,2023-03-17,Entire crime question structure along.
241,2272,6966.84,Withdrawal,2020-11-02,You between choose everything affect walk need.
242,7794,5773.91,Withdrawal,2024-11-28,White bad these cost look allow wind.
243,9736,2426.88,Transfer,2024-09-08,Medical dog energy over bed.
244,6898,1613.3,Debit,2022-01-04,Heart authority our.
245,5470,9923.4,Debit,2023-04-25,Image business own during old.
246,7396,5553.26,Credit,2021-05-06,Time watch wife only will everyone decide head.
247,4718,7038.05,Debit,2020-10-19,Daughter rule southern agency we.
248,2051,2605.73,Transfer,2021-05-21,Interesting source serious throughout note kid term.
249,6079,4429.25,Transfer,2025-02-16,Minute interesting score.
250,1590,7209.11,Deposit,2024-02-07,Executive yard physical how apply we.
251,7690,6124.83,Deposit,2025-06-20,Two fast forget because issue result.
252,7767,148.08,Withdrawal,2020-09-27,Staff game case dog political him fall.
253,7930,1562.67,Debit,2022-05-24,Four hope opportunity bring worker few man.
254,9883,2999.55,Refund,2025-02-18,Skin big far.
255,4916,1536.24,Debit,2021-12-26,Stuff young piece record because visit.
256,9777,580.64,Deposit,2025-05-27,Memory growth claim price middle compare color.
257,951,6581.77,Deposit,2024-02-21,Ball tree college left hit.
258,457,7245.08,Transfer,2020-10-13,Seem lay we bank analysis too anything.
259,1641,1581.94,Transfer,2023-12-26,Material Democrat man group laugh civil but.
260,1997,9610.93,Deposit,2021-04-27,Save speak must research family partner quality.
261,181,9398.81,Deposit,2021-06-07,Gas new report together minute store.
262,5148,7391.73,Credit,2022-08-11,Parent us same nation series tree.
263,4408,2700.68,Withdrawal,2024-08-22,Central newspaper sing religious.
264,3220,1598.26,Refund,2021-04-02,Nature crime yet student shoulder.
265,2019,8747.71,Transfer,2021-06-27,Provide partner go debate.
266,9268,4108.51,Withdrawal,2021-03-10,Range somebody travel west.
267,477,5241.86,Credit,2022-09-06,Common economy like or hard environmental fly officer.
268,3335,5058.69,Refund,2020-08-18,System leader politics born.
269,2619,9861.93,Debit,2024-05-23,Same customer similar explain account.
270,8848,9252.42,Credit,2021-02-06,Go evening lead agency long story.
271,6093,1235.66,Refund,2024-11-11,Example cold forward could.
272,3610,3301.15,Refund,2021-10-01,News form blood subject test rate whole risk.
273,679,6745.04,Deposit,2024-06-06,Court them single capital career crime exist.
274,8799,9094.56,Credit,2024-07-05,Recently ok pick road player.
275,3922,2913.61,Transfer,2025-03-05,Health capital course southern building.
276,5710,8404.02,Withdrawal,2024-11-28,Save else after camera behind surface sign.
277,9349,334.59,Refund,2023-08-19,Source eight consumer while.
278,7247,8087.54,Transfer,2020-08-07,Very fight which young pay.
279,1210,4864.49,Debit,2021-05-04,Response great item happy then interest worry them.
280,8587,5139.57,Transfer,2020-12-05,Education difference land capital spend experience material.
281,5341,7048.56,Credit,2025-01-12,Thing speak adult song step must.
282,7419,9116.84,Refund,2021-10-03,Art threat service now.
283,560,4632.89,Withdrawal,2025-04-13,President whom amount start site project.
284,8537,7579.32,Deposit,2024-05-30,Same center along glass.
285,1663,3295.84,Deposit,2021-06-06,Energy similar catch race imagine.
286,9042,4270.37,Credit,2022-01-25,Culture color population long stay.
287,7225,9903.08,Deposit,2020-09-08,Trade make hair represent quite.
288,6483,7266.7,Withdrawal,2021-08-09,Unit call game trial appear wear painting leader.
289,9753,5269.39,Credit,2023-01-12,Write difficult big me recently fund eight.
290,3426,1678.81,Deposit,2024-01-30,Sound standard bill article protect behind.
291,1551,5418.42,Transfer,2023-06-09,Practice audience require think on entire they.
292,8768,4298.06,Withdrawal,2023-11-22,If either security many another customer sort.
293,451,73.46,Refund,2022-12-02,Law suddenly hundred home each new.
294,9221,7762.45,Refund,2024-12-29,Defense cause adult get feeling career direction ball.
295,9455,6871.95,Credit,2024-03-16,Teacher strategy for on item act stand.
296,5272,8273.34,Deposit,2021-08-12,Toward who become still have pick large.
297,8190,586.21,Deposit,2024-05-26,Well treatment factor several house foot amount.
298,480,3501.65,Transfer,2024-09-24,College sign century seek view produce medical.
299,4066,4832.63,Refund,2023-03-06,Eye step somebody strong plant budget.
300,4941,8665.15,Credit,2023-11-23,Yourself sense moment thus style.
301,4201,1256.51,Credit,2024-08-30,Lot actually rich likely safe girl.
302,2555,8195.84,Withdrawal,2022-10-19,Around suddenly onto factor government network.
303,9260,2674.98,Debit,2023-11-27,See why others put direction into.
304,3798,9823.09,Debit,2023-05-01,Understand break raise popular off.
305,7605,9295.22,Withdrawal,2024-03-27,Focus give then happy.
306,6541,5078.24,Transfer,2022-11-29,Main paper from.
307,5524,7523.98,Credit,2023-05-02,Quality then today other catch thousand girl.
308,8262,213.2,Transfer,2025-04-08,Assume single off town partner thousand modern ball.
309,5841,8496.15,Deposit,2021-05-03,Ago eat up should fund.
310,2342,595.08,Deposit,2021-11-18,Play ten movement its anyone.
311,875,8663.99,Refund,2023-05-13,Particularly during good environmental let meet other human.
312,1218,873.33,Deposit,2024-04-16,Cause professor consumer before.
313,3256,6885.7,Withdrawal,2022-03-08,Last speech stop ever.
314,3325,6682.64,Withdrawal,2022-03-19,Similar consumer arrive.
315,274,8187.46,Transfer,2020-08-23,Answer institution business bill stay support we.
316,1743,6554.77,Deposit,2024-07-17,Question whole time big cultural month.
317,1808,7143.98,Transfer,2021-04-20,Over this respond development effort.
318,5960,2993.36,Debit,2021-07-23,Daughter report attention break shake Mr.
319,8010,3404.08,Credit,2022-07-11,Experience season most support close.
320,3637,7232.51,Deposit,2024-05-01,Know add we anyone create make wrong.
321,551,8851.16,Transfer,2020-11-24,Within city tend discuss.
322,8142,1749.03,Withdrawal,2024-01-08,Seven debate this former memory individual away.
323,7345,608.11,Deposit,2020-10-31,Spring some nature difficult threat treatment.
324,8172,9153.11,Credit,2023-02-02,Step fear budget probably upon catch his beautiful.
325,8051,3168.92,Debit,2020-11-21,Bar wife must rather window.
326,6060,7838.9,Withdrawal,2024-07-17,Challenge theory over debate.
327,9471,410.96,Transfer,2023-11-19,Skin couple morning represent out drop yeah.
328,48,3015.35,Refund,2023-06-21,Sit likely out hard foreign.
329,3939,1372.7,Withdrawal,2025-04-13,Know lot her degree very.
330,3185,9259.08,Deposit,2022-08-27,Such job short anyone require positive crime.
331,6078,9367.25,Transfer,2025-04-20,Similar north most leg.
332,6149,6108.59,Transfer,2024-10-21,Financial own small oil special authority project.
333,1618,8245.06,Credit,2021-04-16,Central another star series security possible lose.
334,2766,1120.54,Withdrawal,2022-09-01,Firm scientist range join.
335,7986,1302.69,Refund,2021-07-11,Various create mouth involve much run such.
336,694,5192.59,Credit,2025-07-22,Allow federal subject understand.
337,875,13.52,Deposit,2021-12-14,Family hand Mr.
338,5586,6615.82,Transfer,2023-11-25,Himself require big no church best yourself.
339,1272,9372.45,Credit,2024-02-09,Next pressure speak food down.
340,8433,5156.79,Credit,2024-03-17,Manager appear rate.
341,281,2808.96,Debit,2025-06-07,Behind wonder order admit.
342,4212,9381.42,Debit,2023-12-26,Mention blood system source fall involve alone.
343,2660,2310.65,Withdrawal,2023-10-13,Important pretty step down interview beautiful.
344,4075,1055.82,Credit,2024-07-06,Energy add glass Congress bag season.
345,22,4131.44,Credit,2025-03-08,Message opportunity wait training.
346,9927,895.09,Transfer,2025-02-19,Current bad as teach.
347,1245,2578.2,Credit,2023-06-12,Receive measure century its career send perform.
348,3607,8768.14,Withdrawal,2021-04-28,After look activity owner feeling now series.
349,9585,9583.44,Transfer,2025-01-26,Project never similar pick idea five.
