TRANSACTION_ID,CUST_ID,AMOUNT,TRANSACTION_TYPE,TRANSACTION_DATE,DESCRIPTION
4879,7454,631.61,Debit,2024-05-25,Movement rich win subject support girl home computer.
4880,9781,5233.96,Refund,2021-07-01,Industry the run reflect what traditional.
4881,269,2906.88,Deposit,2022-08-16,Police natural community line value.
4882,2034,343.23,Withdrawal,2022-01-18,Lawyer grow per party wear get work.
4883,701,1890.9,Credit,2023-10-06,Material film seat several image ask.
4884,182,172.33,Transfer,2022-07-28,Military couple age rich resource picture.
4885,109,6415.82,Debit,2025-06-15,Will smile factor billion fast run.
4886,8633,4576.66,Credit,2023-03-17,Actually church five budget south now.
4887,8119,7834.77,Credit,2022-02-21,Can whom identify peace.
4888,6662,6935.9,Transfer,2022-04-13,Theory our light argue.
4889,6501,879.26,Debit,2025-07-23,Agent appear practice federal option help subject.
4890,8848,3253.7,Deposit,2023-01-03,Speak same somebody response sell industry.
4891,4330,1508.42,Deposit,2024-05-29,Be form story power stuff remember.
4892,379,7733.66,Withdrawal,2025-01-31,A cost eight make suddenly.
4893,3254,3234.64,Debit,2021-01-07,First despite eye cup general far.
4894,3786,5174.48,Debit,2022-03-19,Education hair down especially you recently Mr.
4895,2787,2775.0,Debit,2021-11-10,Maintain structure street significant.
4896,7178,5702.05,Debit,2022-09-29,Option top product wrong year.
4897,617,1602.4,Refund,2024-11-03,Election safe represent although.
4898,5848,4678.27,Refund,2020-10-08,Whether environmental outside per evening.
4899,2664,3458.59,Withdrawal,2022-07-05,Large among step might over remain however.
4900,8928,6759.36,Transfer,2021-12-12,Read participant practice second improve.
4901,1982,7825.46,Deposit,2023-07-23,Technology left seven.
4902,9438,1843.15,Transfer,2022-10-10,Citizen order day personal left move.
4903,193,5618.16,Withdrawal,2022-05-04,Movie argue their write thus total fill.
4904,3536,6286.23,Credit,2025-01-27,Think bank happy available how marriage scientist.
4905,8091,3440.24,Deposit,2024-07-04,Accept near politics indeed above.
4906,9136,8145.39,Transfer,2022-09-02,Since image realize street.
4907,432,8632.78,Refund,2025-05-20,Everybody avoid authority Mrs.
4908,250,6111.26,Credit,2020-11-20,Seven laugh wife one local science success our.
4909,9697,5164.57,Transfer,2021-04-29,A focus she least difficult agree final.
4910,3018,1970.65,Debit,2023-05-12,Around maybe experience describe.
4911,5387,2258.12,Debit,2020-08-26,Audience I child.
4912,7911,3346.4,Refund,2020-07-30,Summer evidence hospital.
4913,6936,254.23,Deposit,2024-02-25,Send two strong food mouth perhaps.
4914,7967,9233.11,Refund,2020-12-07,Current partner get black.
4915,3950,1124.9,Transfer,2024-02-07,Traditional individual cup send them head.
4916,8252,6902.29,Withdrawal,2023-10-09,Even language they democratic.
4917,5283,461.22,Credit,2025-01-29,Instead behind guy.
4918,872,1904.63,Transfer,2020-08-20,Stay how machine author ten maybe husband.
4919,9174,1120.19,Debit,2022-06-10,Soldier stop national audience too trip design.
4920,5379,7948.78,Debit,2025-07-20,Actually art ground scene.
4921,4677,6779.47,Refund,2021-03-16,Owner service training be front.
4922,8971,6420.97,Debit,2023-12-28,Fly indeed commercial real skill evening.
4923,36,9041.06,Deposit,2023-11-16,Now phone within yes fish pick capital capital.
4924,4857,8610.16,Refund,2020-07-29,Friend itself weight.
4925,1634,8568.18,Withdrawal,2023-01-24,Military nature brother international piece go by.
4926,9061,9813.02,Transfer,2022-06-07,Water where discover leader outside.
4927,8429,931.37,Refund,2021-10-01,Kitchen big rule across stage teach manage.
4928,8145,5896.45,Withdrawal,2024-12-28,Service mean financial population.
4929,2323,9734.78,Credit,2020-12-27,Board garden trial.
4930,5672,1450.68,Withdrawal,2023-04-11,Bad me prepare.
4931,8252,493.3,Deposit,2024-05-12,Walk election rule wrong.
4932,6290,9044.85,Debit,2023-06-14,Official a marriage wear time door material necessary.
4933,1845,4715.8,Transfer,2024-10-08,Standard series space perhaps drug religious.
4934,2390,504.29,Credit,2025-02-25,Paper live level analysis eat budget four.
4935,9365,7805.1,Refund,2021-10-29,Cause follow Democrat owner product charge work.
4936,4671,9211.98,Refund,2020-09-17,Hotel argue conference cover.
4937,7852,2567.92,Withdrawal,2020-11-11,Thing central then reality leader.
4938,9825,8713.24,Refund,2021-06-23,Between close personal million American budget.
4939,8287,748.02,Transfer,2024-02-11,Side animal within safe local eat.
4940,4372,151.69,Refund,2020-07-27,Write service house administration.
4941,8719,6780.77,Withdrawal,2023-02-22,Dream major source collection his know.
4942,4117,4652.82,Credit,2023-01-30,Finally event their million.
4943,8012,4030.21,Withdrawal,2024-02-17,Never generation opportunity decision power hit.
4944,3790,7194.44,Credit,2022-08-19,Feeling far hot main.
4945,787,8823.9,Withdrawal,2022-10-12,Two low part scientist.
4946,408,9659.34,Deposit,2022-06-01,Audience company claim best full but moment.
4947,9998,47.18,Deposit,2025-03-05,Seven develop word chair discover chair around.
4948,273,1355.23,Debit,2025-07-08,Role our forward draw experience.
4949,2048,6709.23,Refund,2023-02-06,White step money speech.
4950,5192,7497.24,Deposit,2024-08-25,Plan especially create their choose camera.
4951,4571,326.41,Credit,2024-03-20,Already interest situation participant those.
4952,8794,7218.91,Withdrawal,2023-12-25,Happen contain life most star home you.
4953,484,5636.57,Deposit,2023-01-17,Owner hundred describe mouth.
4954,2695,2758.17,Refund,2021-02-28,Local yes nature.
4955,2856,2223.16,Refund,2024-01-02,Build lawyer indicate activity wear when suffer.
4956,3622,7095.57,Withdrawal,2021-05-30,By drug he degree say director.
4957,9968,1490.41,Refund,2022-12-10,Art most soldier exactly.
4958,4472,9650.19,Withdrawal,2023-05-31,Play believe as final.
4959,6165,1345.3,Refund,2024-07-07,Success company unit around father.
4960,4693,2327.81,Deposit,2022-08-12,Event throughout choose hotel.
4961,6676,2442.26,Transfer,2024-12-12,Physical onto decide factor first.
4962,8661,4440.7,Transfer,2024-04-03,Recognize mention media power idea young.
4963,501,6385.0,Withdrawal,2021-09-02,Feeling build travel.
4964,4808,3738.67,Credit,2021-05-23,Top behind figure matter pay scene few.
4965,4909,4008.3,Debit,2024-11-08,Eight response sing.
4966,5131,4173.71,Debit,2023-04-09,Stop white them certain.
4967,5696,7071.92,Withdrawal,2023-06-29,You executive military.
4968,4305,4243.29,Refund,2024-07-10,Fine structure because final thought service authority.
4969,1307,4488.12,Refund,2020-08-19,Gun project letter unit north civil research speech.
4970,621,6592.47,Debit,2021-12-22,Movement middle find believe.
4971,4052,3404.94,Deposit,2022-11-24,Process vote protect eat option rule.
4972,1241,3986.6,Refund,2024-05-03,Food western piece statement born expert those affect.
4973,8880,9324.12,Deposit,2023-12-21,Fact car democratic deal take do image.
4974,6449,9199.62,Transfer,2023-04-24,Affect themselves many call read production.
4975,4430,7500.06,Withdrawal,2021-05-04,Live cup unit record he senior father.
4976,4194,9512.52,Refund,2022-11-05,Positive tree she ready need significant shoulder.
4977,1691,964.99,Debit,2024-07-10,Radio structure standard bad.
4978,512,9196.5,Credit,2021-06-05,Sort space now four want effect gun.
4979,4165,5597.5,Deposit,2024-11-18,Media magazine practice great force cold especially stop.
4980,6364,1309.47,Refund,2024-02-19,These sort officer rest.
4981,1021,8956.48,Transfer,2024-11-18,Security seem because.
4982,1846,3018.48,Transfer,2024-01-08,Community style interesting law according.
4983,5050,2228.38,Debit,2022-06-03,Mother popular instead so agency another apply lay.
4984,5592,2122.91,Withdrawal,2022-06-20,My budget example sound method body later.
4985,5084,3276.29,Transfer,2025-01-03,Bed decide stop task fear government actually.
4986,486,55.03,Debit,2021-07-22,Matter allow crime unit education north home.
4987,1834,4504.02,Debit,2023-04-29,Participant value wait moment stuff.
4988,5929,601.52,Refund,2022-10-13,Understand do nearly Mrs.
4989,4859,1688.54,Refund,2021-05-10,Increase agent real main reduce company can they.
4990,3619,5267.88,Debit,2022-09-18,Security crime perform southern during dream tell.
4991,9866,5731.01,Deposit,2023-10-02,Thought TV author because suddenly.
4992,9192,8644.54,Debit,2022-08-17,Opportunity order catch tell.
4993,2735,8474.56,Credit,2021-02-15,Job deep leader available crime reach.
4994,1764,8985.76,Refund,2022-02-17,Figure tough experience answer.
4995,3449,5977.06,Refund,2024-04-08,Growth goal parent local red realize away.
4996,8061,485.34,Debit,2022-03-20,Admit run generation wait most run.
4997,3867,1779.03,Debit,2023-10-24,Minute artist control able billion add.
4998,7272,2305.86,Deposit,2024-04-07,Surface north until price.
4999,5309,8210.76,Debit,2025-06-08,Learn simply note help image foot garden.
5000,321,8207.98,Transfer,2025-01-07,Chair nothing single popular my great.
5001,8351,5037.24,Deposit,2021-09-07,Letter look coach discuss thank.
5002,7759,7903.72,Credit,2024-10-25,Mission sit chance against general mind.
5003,5801,8640.17,Transfer,2022-10-29,Response late recognize program.
5004,391,1651.72,Deposit,2022-04-03,Serious population over appear whatever thus conference.
5005,6826,8973.77,Debit,2022-07-06,Place offer billion society.
5006,3784,4266.0,Refund,2023-06-15,Action happen Democrat ready way energy should.
5007,808,4421.21,Refund,2022-06-21,Instead bed but little model first.
5008,8597,9916.79,Refund,2022-11-21,Song list behind kind.
5009,2736,9827.2,Transfer,2023-11-26,Member certainly million still bank administration ground list.
5010,3539,4469.3,Withdrawal,2024-06-07,Out according eat between let animal year certain.
5011,8625,1788.91,Refund,2024-05-04,Must get boy news.
5012,7681,8213.68,Deposit,2022-01-02,Usually fund everybody lay make member.
5013,2073,7737.55,Debit,2021-08-14,Until customer arrive relationship argue.
5014,7458,3892.02,Debit,2021-07-27,Send continue truth possible shake.
5015,8320,6548.65,Refund,2022-04-16,Agent response mouth detail environmental plan certain left.
5016,1067,6069.7,Transfer,2024-08-31,Success effort mention office born water.
5017,4634,7027.28,Withdrawal,2023-05-04,Spring education those two single tree dark.
5018,9494,220.09,Transfer,2021-12-25,Provide south benefit ten successful attack.
5019,6497,2920.05,Refund,2022-10-10,Goal government high management describe.
5020,4788,6685.11,Deposit,2022-03-31,With of data five social spring pretty.
5021,4228,7840.33,Withdrawal,2023-02-13,Position century bag game.
5022,2445,8932.69,Transfer,2022-03-31,Both maintain free Democrat activity.
5023,9649,5817.66,Credit,2020-11-18,Store board hospital song professional suddenly.
5024,313,3909.16,Withdrawal,2021-10-31,Which total pick.
5025,1420,2066.89,Refund,2022-07-21,Half home go street.
5026,9426,8696.93,Deposit,2025-04-24,For accept bed.
5027,2482,1879.63,Refund,2025-05-17,Line line find stop cell institution local.
5028,9345,3287.13,Deposit,2021-02-01,Training talk offer building budget certain particularly relate.
5029,7548,4885.73,Transfer,2025-05-10,Sort pattern one discuss training training.
5030,8322,7549.22,Debit,2022-07-13,Light return line share.
5031,4379,9741.01,Transfer,2021-11-06,Shake attack bill describe change.
5032,8780,9802.41,Refund,2024-11-08,Term hit see friend brother.
5033,4028,5395.59,Withdrawal,2022-01-31,Those medical than.
5034,3133,9589.89,Credit,2024-08-21,War audience final stock game improve.
5035,2658,1047.18,Deposit,2025-06-06,Message field according region modern.
5036,4497,2064.74,Credit,2023-05-13,Executive compare card range campaign.
5037,6079,3347.85,Debit,2021-02-09,Need executive experience accept people must.
5038,2237,5034.62,Transfer,2025-07-11,Defense enter every himself tree agent when.
5039,3021,2410.4,Withdrawal,2021-01-08,Minute reflect clear store top.
5040,9297,6742.34,Debit,2020-09-28,Her middle test bed these we bank.
5041,7755,4820.48,Refund,2022-08-26,Light might another.
5042,1542,4202.45,Refund,2021-02-28,Professional provide finally attention Republican.
5043,9863,9947.84,Deposit,2021-09-04,Foreign whatever western life majority difference ball.
5044,9103,3749.81,Debit,2023-09-09,Certainly eight rule picture newspaper it majority.
5045,3450,3588.68,Debit,2023-07-11,Worry toward might weight artist.
5046,7526,3528.11,Refund,2024-12-17,Pick fund quite bring.
5047,8429,9624.91,Transfer,2023-12-21,Camera enough culture laugh customer cup against.
5048,1488,6802.5,Withdrawal,2024-07-26,Rock rock view minute wall everybody.
5049,8890,6447.32,Refund,2021-03-05,Recently low hear make Republican.
5050,2743,2324.39,Deposit,2024-02-01,Third member area especially your contain student.
5051,3662,8254.51,Credit,2022-11-08,Upon plant stuff military up.
5052,9369,4004.03,Transfer,2021-05-08,Across interview child media question performance.
5053,4680,213.87,Withdrawal,2023-01-05,Find degree or value fly from.
5054,585,1067.27,Credit,2025-01-23,Like person around charge little.
5055,6566,6217.7,Transfer,2021-06-22,College create beautiful task season.
5056,8093,7172.43,Debit,2025-06-16,Expect career agree and size.
5057,4206,3329.34,Credit,2022-03-07,Ask leader voice hour.
5058,8916,1085.09,Debit,2023-01-27,Provide ahead pass behind reduce moment.
5059,1120,6118.6,Transfer,2022-07-31,His live total group.
5060,3063,2941.94,Deposit,2024-11-23,Affect theory front.
5061,3187,2253.13,Withdrawal,2024-07-24,See tax smile reach institution line.
5062,8291,3743.06,Withdrawal,2022-08-14,Feeling large certain.
5063,8165,422.25,Transfer,2021-12-29,Wrong evening certainly machine minute certainly second.
5064,9183,2734.75,Credit,2021-12-08,Space he agree start me popular offer.
5065,8900,8321.53,Transfer,2022-10-21,Floor produce affect raise religious.
5066,7105,9399.27,Transfer,2022-08-07,Black white training concern night figure.
5067,7086,3863.58,Deposit,2025-06-24,Total book simply member which design medical.
5068,5349,694.7,Deposit,2021-10-27,Herself institution near father start.
5069,3349,2606.11,Debit,2023-10-12,In son ability care play since affect.
5070,9791,2252.88,Credit,2022-11-06,His ago office child him between.
5071,9243,4058.25,Transfer,2022-06-15,Cost her direction church population describe money television.
5072,4865,4719.85,Withdrawal,2022-06-05,Risk skill positive.
5073,5429,4265.16,Transfer,2021-07-10,Old fish could lot information research subject.
5074,6515,5896.52,Debit,2022-08-12,Research above half pass stay push defense.
5075,2578,4463.28,Deposit,2022-01-13,Measure card for.
5076,9218,5049.4,Deposit,2024-11-22,Right mission to believe least statement.
5077,3883,468.34,Withdrawal,2023-01-13,Defense easy religious same teacher above.
5078,9429,7946.74,Transfer,2023-05-01,These culture health artist citizen edge maybe feel.
5079,381,8342.89,Withdrawal,2021-10-23,Member risk stay know PM.
5080,3889,8011.98,Credit,2020-09-26,Agent peace man house guess theory.
5081,4856,6407.25,Refund,2022-03-07,Red law each color.
5082,265,47.69,Debit,2024-06-24,Imagine their result share customer.
5083,7814,4873.9,Credit,2023-08-20,Receive south local find page.
5084,1672,340.36,Debit,2024-11-19,Eight medical trouble table there lot.
5085,4884,5992.61,Transfer,2022-03-20,Machine which bank.
5086,2616,6843.63,Refund,2022-10-17,Card represent most become yeah expert take produce.
5087,8358,1949.41,Refund,2022-07-22,Seek later foreign customer possible.
5088,4227,2079.11,Withdrawal,2021-07-04,Can data collection opportunity sit sit window might.
5089,4184,7297.71,Refund,2022-12-15,Paper simply century cost in for director bank.
5090,1206,7594.5,Deposit,2021-03-17,Have official theory man sit choice pull smile.
5091,3692,3316.08,Withdrawal,2024-11-02,Design middle believe organization worry employee.
5092,7060,5869.93,Refund,2023-09-07,Future rest anyone appear door direction year.
5093,6304,3487.05,Credit,2023-08-20,With well both camera top card way.
5094,3317,5717.8,Debit,2023-05-10,Result page success.
5095,8046,8703.93,Transfer,2023-09-01,Sit soldier avoid billion.
5096,9872,6719.63,Transfer,2023-05-06,Find seem process phone accept.
5097,6507,9385.11,Transfer,2021-04-30,Employee dream general drug meeting.
5098,8671,8794.16,Deposit,2021-12-12,Add force although realize cell listen local.
5099,8108,4836.84,Deposit,2022-02-08,Official something weight nice enter job.
5100,4078,424.37,Debit,2021-06-26,Ok clearly I couple someone.
5101,1778,6256.28,Transfer,2024-12-08,Cover impact leave.
5102,1849,6768.79,Withdrawal,2020-12-06,View former yes evening because method.
5103,9645,5761.1,Debit,2022-11-24,Loss instead child.
5104,3185,6440.73,Transfer,2021-02-11,Project improve now authority write.
5105,2330,7332.59,Debit,2024-02-14,Possible record large dog side author play.
5106,9633,5041.23,Refund,2021-04-20,Face near car instead reduce.
5107,9130,4225.14,Transfer,2023-09-27,Real bad education plan rather wife.
5108,160,4262.4,Credit,2022-05-30,Investment around road often party dark.
5109,3657,126.7,Deposit,2022-02-13,Alone water because house point station cultural.
5110,242,1149.79,Debit,2023-12-25,Mrs one religious week.
5111,2942,1088.87,Debit,2024-03-10,Part create second billion industry.
5112,105,3781.68,Debit,2023-10-15,Agreement issue information movement building else source.
5113,8088,6370.51,Refund,2021-05-18,According must sell character.
5114,8914,2464.33,Credit,2025-01-21,Campaign kid summer among rest.
5115,9645,8594.39,Refund,2020-11-16,Break wait American picture large about upon.
5116,5504,3005.24,Withdrawal,2024-11-24,Bill thank throw firm simply strategy.
5117,3472,9837.92,Refund,2023-07-14,Company decide situation let.
5118,8563,6337.88,Refund,2024-09-02,Skill step man.
5119,6597,5292.1,Credit,2024-12-05,Energy treatment hear building down build activity left.
5120,1893,2749.12,Credit,2023-05-16,Read attack various price.
5121,5713,1408.65,Refund,2022-10-28,Safe project though stay a including once eight.
5122,6732,5920.03,Credit,2020-10-13,Reach manager store paper.
5123,892,9397.52,Deposit,2021-11-16,Suggest administration produce beyond financial after gun.
5124,7085,831.72,Transfer,2022-05-22,Much debate morning prepare young free real.
5125,3282,3210.2,Withdrawal,2023-08-19,Store finally threat ago both.
5126,6973,7533.85,Debit,2022-03-23,Officer American ten drive oil sea beyond see.
5127,9557,9781.68,Debit,2022-11-09,Anyone herself whole.
5128,5624,3818.88,Deposit,2022-10-12,Enough site hold front.
5129,6424,5257.99,Credit,2020-12-10,Forget change there.
5130,3110,1347.26,Withdrawal,2022-06-14,Get part address least good not.
5131,8139,6945.44,Debit,2025-04-22,Carry happen hair sing.
5132,570,4731.19,Refund,2021-04-28,Management card want indicate model voice area.
5133,580,1568.27,Transfer,2023-06-22,Provide color executive church.
5134,7606,5599.47,Credit,2023-10-19,Hot interest draw usually sister decade.
5135,8306,9596.22,Debit,2020-09-03,Bill song least than.
5136,2943,1963.73,Debit,2021-02-02,Officer may seem little her plant style.
5137,8575,8034.44,Withdrawal,2023-02-08,Interesting cause enough again probably treat increase them.
5138,5691,6883.53,Withdrawal,2021-08-20,Catch best them main.
5139,2390,3649.22,Debit,2021-03-24,Strong cut democratic.
5140,4972,4058.96,Refund,2023-10-21,Management sit keep such central hotel.
5141,8409,7195.26,Debit,2021-06-13,Type movement say religious better.
5142,5554,8349.37,Debit,2021-05-03,Kid whether long act music expert third.
5143,4604,4145.77,Refund,2024-07-25,Think think policy bad should.
5144,2500,7000.97,Deposit,2022-02-28,A daughter serve seem.
5145,5269,4697.97,Withdrawal,2025-04-29,Impact camera again case not modern.
5146,1758,1416.56,Transfer,2023-06-08,Lead statement opportunity condition.
5147,5707,34.3,Credit,2022-04-07,The condition son bill late per prevent.
5148,5010,3101.41,Debit,2021-10-23,Career watch person big.
5149,8811,5899.37,Transfer,2020-10-02,Listen collection go agency shoulder morning heavy.
5150,1499,4677.75,Withdrawal,2025-03-14,Describe small start despite choice.
5151,2162,5686.49,Withdrawal,2021-08-16,Middle your live involve look interview ball.
5152,4090,7978.15,Transfer,2024-03-10,Position task computer turn stop defense history.
5153,7033,1615.54,Deposit,2024-11-02,Model beyond drive school option prepare.
5154,6410,6854.35,Transfer,2020-10-03,Effect wife visit remain.
5155,9416,117.89,Credit,2022-06-04,Action trip her magazine her attack black.
5156,6639,4071.93,Deposit,2025-04-01,Thousand instead way pull under social how.
5157,9362,7810.08,Transfer,2022-10-03,Term voice goal south.
5158,8703,3759.97,Refund,2024-08-14,Would computer as north source charge suffer.
5159,6152,861.17,Deposit,2022-11-11,Each pass several relationship especially realize.
5160,5379,2508.85,Debit,2023-10-29,Might probably number high daughter goal letter.
5161,3231,3661.26,Credit,2023-03-17,Couple environmental magazine man your.
5162,3776,2421.85,Withdrawal,2025-06-19,Water building hit.
5163,3605,9616.42,Transfer,2023-03-30,Clear term traditional Republican collection big human.
5164,3137,652.23,Debit,2023-06-01,Eat forget us religious analysis budget.
5165,7428,3023.56,Withdrawal,2024-07-21,Without serve someone thousand free.
5166,8801,4914.74,Refund,2020-08-14,All teach state less.
5167,5174,715.24,Refund,2020-09-13,Black catch contain line information.
5168,6824,5000.18,Refund,2020-10-15,Site professor threat herself.
5169,1088,8750.56,Credit,2021-04-21,May fast test nor he prepare.
5170,8787,7772.38,Credit,2021-12-03,Pressure treat senior up arm.
5171,4066,7520.54,Refund,2025-03-29,Say public yeah.
5172,7795,389.83,Withdrawal,2024-12-28,Start probably keep might often represent radio.
5173,5356,2074.99,Transfer,2022-02-16,Television sort approach process identify business glass American.
5174,1590,2153.91,Refund,2021-05-28,Receive apply few music.
5175,7094,9215.99,Credit,2023-12-25,Order local camera edge option.
5176,4204,7314.11,Debit,2021-02-17,Strong hundred material suffer.
5177,6171,1577.3,Credit,2023-12-24,Report coach report seven lawyer suggest a.
5178,203,484.84,Transfer,2025-04-28,Factor south leader design own.
5179,6634,8667.88,Refund,2021-05-07,Film foreign its worry image force.
5180,9099,5134.08,Withdrawal,2022-07-01,Appear leader brother meet pretty.
5181,5447,643.99,Credit,2021-04-23,Find station crime wear power.
5182,578,5310.19,Credit,2022-03-30,View page record moment dog spring pretty.
5183,63,9013.64,Transfer,2020-10-01,Public letter culture son state we authority after.
5184,1443,5559.93,Transfer,2021-01-30,Information newspaper simply blood area right sister.
5185,8342,3686.54,Debit,2021-11-29,Five eat soon central word eight.
5186,3209,7186.81,Credit,2020-12-17,Main per positive kitchen top total.
5187,1577,442.69,Transfer,2020-10-01,Sure modern story program food contain.
5188,1076,8647.13,Debit,2022-01-20,Federal Mrs PM consumer.
5189,3996,8855.17,Deposit,2021-05-25,Receive beautiful front will audience.
5190,9608,6086.48,Refund,2024-08-04,Stand skill yourself eight.
5191,3813,5106.94,Refund,2023-05-20,Front career truth indeed improve member bed month.
5192,1018,6836.34,Debit,2024-08-06,Suffer step indeed thought tend world.
5193,539,8107.17,Transfer,2025-06-10,Final amount compare easy writer strategy hit.
5194,3250,9312.66,Withdrawal,2024-01-20,First shoulder fight recently present enjoy.
5195,4675,1925.31,Withdrawal,2024-06-04,Travel piece political recognize movie admit.
5196,6871,1702.41,Transfer,2025-02-02,Author ability change six west.
5197,2661,7709.4,Deposit,2024-08-23,Top glass adult message degree performance laugh.
5198,4182,1971.59,Refund,2020-10-20,Thought game lose focus realize.
5199,5147,5986.75,Deposit,2022-12-17,Scene face appear shoulder.
5200,6656,1672.47,Refund,2025-03-28,Walk serious relationship foreign least.
5201,3740,3705.2,Debit,2021-02-04,South name start drug fly us.
5202,6667,9983.36,Withdrawal,2022-01-19,Religious role choose high month ten.
5203,550,1355.36,Deposit,2024-07-22,Guy put more practice remain sea.
5204,6266,5596.93,Withdrawal,2023-07-27,Partner whole day scene listen phone staff treatment.
5205,2669,4625.92,Debit,2024-07-05,Debate city dream draw store outside collection.
5206,734,4623.77,Refund,2023-05-10,Sister sort with want community grow thousand manager.
5207,6041,1298.78,Credit,2022-04-06,Cultural wonder quality arm production car.
5208,3938,6001.82,Deposit,2025-07-23,Nice give factor federal particularly lot.
5209,1820,3195.56,Transfer,2023-01-27,Happen throw agree senior.
5210,5572,2208.56,Refund,2023-06-01,Attorney reveal building heavy choice.
5211,7581,7240.09,Transfer,2022-07-14,Dog some dinner power lose certainly area.
5212,9850,4871.54,Debit,2025-06-24,Institution decide no address detail cover success.
5213,990,9979.32,Credit,2020-10-25,Best prepare result loss system edge consumer fall.
5214,4743,5847.05,Withdrawal,2025-02-22,On talk police.
5215,6486,5444.94,Credit,2024-06-01,Budget few part hot.
5216,8219,3113.21,Credit,2023-09-22,Somebody middle future would art person.
5217,8760,1945.17,Credit,2024-06-30,However serve bill clear writer finally.
5218,6920,5952.3,Refund,2024-11-10,Fight economic property different final page.
5219,7873,8342.56,Withdrawal,2025-07-22,Little radio one could door.
5220,6055,834.92,Credit,2023-09-13,Actually bed choose several include those.
5221,6152,5980.18,Withdrawal,2024-03-22,Develop rock smile.
5222,6829,9824.71,Refund,2021-04-28,Father everybody Congress child trade matter home here.
