TRANSACTION_ID,CUST_ID,AMOUNT,TRANSACTION_TYPE,TRANSACTION_DATE,DESCRIPTION
7308,5368,2828.12,Deposit,2024-07-20,Car church television always success different.
7309,1627,3522.61,Withdrawal,2022-04-11,Agent effort remain purpose material.
7310,4381,3229.1,Withdrawal,2024-10-26,Avoid tell example industry.
7311,1144,8832.71,Transfer,2021-05-28,Window who condition sell per guess blood middle.
7312,5288,3987.44,Deposit,2023-06-08,Yes beat quite look.
7313,2713,2113.92,Withdrawal,2021-05-13,Room ago eat argue forward wall.
7314,5891,7692.91,Deposit,2020-11-28,Success fear Mrs on store collection condition.
7315,4340,134.0,Refund,2022-01-07,Attack marriage yes build reflect.
7316,8439,536.75,Withdrawal,2023-03-30,Statement get after meeting peace also.
7317,3079,376.31,Withdrawal,2022-10-25,Industry police television mother.
7318,8341,3269.63,Transfer,2021-07-08,Statement run wear sell but decision war.
7319,2386,897.91,Deposit,2024-01-05,Scene window serious article section five.
7320,859,7864.98,Transfer,2022-02-15,Size minute visit former.
7321,2241,6433.46,Credit,2024-10-31,Table office writer.
7322,892,8085.65,Refund,2023-03-01,Quickly remember behind church theory born.
7323,4064,1562.07,Withdrawal,2020-08-22,Future girl suffer each able call fund.
7324,9109,9032.34,Withdrawal,2021-04-26,Language fine reason young follow trial book.
7325,5101,1708.45,Transfer,2025-03-19,Shake professional smile cultural.
7326,3048,1995.31,Transfer,2020-10-22,Not event air different argue skill never.
7327,5243,4829.32,Debit,2024-11-20,Exist heavy in art movie feel.
7328,4309,5369.55,Credit,2021-10-13,Lose thought quite organization chair board.
7329,2983,2280.92,Refund,2021-05-13,Since final care fall military probably.
7330,3299,5625.65,Credit,2021-01-31,First we end.
7331,5731,3957.61,Withdrawal,2022-10-03,Million area opportunity young risk food.
7332,7879,3503.4,Debit,2022-02-21,Benefit free environment tonight remain value fly.
7333,1256,1025.02,Refund,2020-08-12,Discuss organization student while since anyone pressure.
7334,4927,6126.25,Refund,2021-12-10,Serve later box way cover star.
7335,3432,1494.76,Credit,2020-11-29,Owner sell each over above.
7336,3609,8887.92,Transfer,2022-02-08,Game support entire religious food.
7337,4866,3318.99,Deposit,2023-12-27,Both marriage music it culture have high.
7338,1005,2944.39,Debit,2021-12-04,Gas main about kid require.
7339,3721,4574.53,Refund,2023-08-17,Citizen game still address partner song.
7340,9733,2150.22,Transfer,2020-11-02,Read both machine force region goal fast.
7341,5822,6568.7,Transfer,2022-05-27,Hot act kitchen many away treatment yes eight.
7342,4799,9652.43,Transfer,2024-06-28,Sure record report growth game any between write.
7343,6382,2988.86,Transfer,2025-02-01,Music treatment agree soon yourself issue line.
7344,5106,2393.64,Credit,2022-11-21,Bag space with radio table hold.
7345,1962,1745.13,Debit,2021-07-14,Game project account page wall.
7346,4113,961.23,Debit,2022-10-22,Safe real become ever much program south increase.
7347,3576,1462.15,Debit,2024-04-24,Next rise school appear.
7348,6479,3261.37,Refund,2023-07-11,Activity support table choose contain tend start enough.
7349,1536,9400.51,Deposit,2023-09-01,Keep condition during first against.
7350,761,4174.18,Transfer,2024-12-17,Anyone process education apply senior social.
7351,4414,3615.76,Debit,2021-07-04,Seek hair technology dream.
7352,4455,1367.45,Refund,2021-02-06,Under score natural.
7353,4098,8093.02,Transfer,2022-03-03,Standard hundred scene idea would near.
7354,3644,4222.36,Credit,2022-08-24,Imagine size staff follow.
7355,1808,640.82,Refund,2023-08-15,Right out treat involve put every.
7356,129,2166.23,Withdrawal,2021-09-30,Provide president real friend city enter a return.
7357,8742,1987.15,Deposit,2023-01-28,Cover chair let.
7358,4790,3751.17,Transfer,2021-10-27,Heart executive must.
7359,4966,5960.63,Credit,2021-07-31,Glass conference stand community successful.
7360,6651,4461.76,Withdrawal,2021-08-31,Particularly on where knowledge leg its fish.
7361,8008,836.66,Refund,2021-01-19,That whether center ball.
7362,5749,6139.38,Withdrawal,2025-05-14,Bar season despite still her nation during.
7363,3772,149.4,Transfer,2023-10-15,Speak imagine report relationship well enough mission.
7364,7748,9491.96,Deposit,2021-08-15,Senior course miss sort short series.
7365,7454,854.16,Deposit,2020-10-01,Why common full yet soldier.
7366,1690,9239.71,Withdrawal,2025-03-10,Feeling threat mean because magazine avoid friend.
7367,4161,5294.04,Debit,2022-08-17,Western on office worker weight trouble recent.
7368,4682,5301.61,Withdrawal,2022-09-14,Baby heart wonder bag.
7369,4279,2086.45,Withdrawal,2020-08-06,Guess arm under step writer.
7370,5342,6218.04,Refund,2022-03-25,Green unit maintain stock human nearly anything.
7371,3551,2163.46,Credit,2023-03-04,Matter true conference.
7372,4745,3430.52,Refund,2022-05-13,Value future provide against experience together meet indicate.
7373,4901,65.9,Deposit,2024-11-08,Blood total partner today new.
7374,8030,5853.57,Withdrawal,2020-12-07,Compare weight first with material out.
7375,9509,2221.33,Debit,2022-10-05,Such treat best.
7376,6908,5468.16,Debit,2021-09-18,Woman teacher gun lay close ask.
7377,9203,5738.47,Refund,2024-11-02,Affect report describe tough although culture mouth.
7378,9223,6190.72,Refund,2021-05-18,Never dinner trip number thousand.
7379,4715,4646.15,Debit,2021-08-03,Evening lay least lead hear president investment.
7380,8934,3959.08,Credit,2024-09-17,Address first fear behavior outside.
7381,408,659.52,Withdrawal,2024-09-03,Create hand important right just several of.
7382,7013,5434.31,Credit,2021-12-14,Administration beautiful executive anything chance approach economic product.
7383,7246,2167.25,Refund,2021-05-24,Development I size rock society student finally.
7384,102,2733.67,Debit,2022-01-22,Large nor receive.
7385,4583,6735.44,Debit,2021-10-11,Want purpose expect article.
7386,2200,6049.92,Credit,2022-05-24,Action attorney whose upon make choose.
7387,3396,8730.35,Withdrawal,2023-03-29,Quality reflect dream kid report her concern environment.
7388,8619,3862.66,Debit,2021-12-17,Live something policy second.
7389,1045,429.68,Debit,2023-04-06,Form give mother stock produce great certainly religious.
7390,3973,6810.05,Refund,2023-08-06,So lead morning important.
7391,4317,5429.0,Withdrawal,2024-12-08,President happen Democrat teacher way.
7392,4416,4682.8,Deposit,2020-11-05,Finally environment enough wrong enjoy check page what.
7393,7765,7514.38,Refund,2022-07-16,Western deep state page read receive.
7394,768,7796.12,Refund,2024-05-02,Let international score man building run.
7395,1409,1540.49,Refund,2023-05-24,Figure officer speak.
7396,4675,5186.73,Credit,2021-10-01,His author game past least.
7397,8521,5068.04,Refund,2024-11-22,Season you international fly produce.
7398,8084,1859.36,Withdrawal,2024-12-31,Could whole benefit.
7399,6713,9840.57,Withdrawal,2025-01-23,Him plan easy station tell.
7400,1572,8528.65,Deposit,2023-08-17,Attention dream provide standard mean.
7401,5023,7668.17,Debit,2022-05-28,Once easy lot put.
7402,7619,4452.7,Transfer,2020-08-29,Send fact low difference occur assume serious.
7403,5429,3566.45,Deposit,2025-06-08,After rule seat option policy land history.
7404,4917,5529.36,Transfer,2023-08-20,Clearly enter reveal wall off city economic.
7405,3360,7740.53,Deposit,2024-03-01,Summer skill radio leader ahead action local.
7406,453,5084.0,Debit,2023-01-20,Heavy instead age staff.
7407,8993,2092.27,Credit,2024-02-22,Expert religious include play their.
7408,6176,1728.56,Deposit,2023-04-25,Sign right begin charge hair.
7409,7819,9965.09,Withdrawal,2021-08-18,Machine expert lot alone.
7410,1436,1484.73,Credit,2024-09-28,Police east life form American ground top.
7411,9541,2471.86,Refund,2023-11-17,Nothing money resource character its responsibility heart.
7412,2520,800.18,Debit,2020-07-28,Couple bank weight think customer able price.
7413,5123,9833.99,Withdrawal,2021-06-17,Listen season seat summer.
7414,7113,9193.69,Refund,2021-01-05,Rest reflect the bag loss often maybe.
7415,2558,8477.38,Transfer,2020-12-13,Article probably natural this weight image.
7416,3890,9487.68,Withdrawal,2021-01-18,Fact business throughout tell field political just.
7417,6488,6678.9,Withdrawal,2022-10-09,Specific yes discussion company more however law.
7418,2709,5836.32,Debit,2020-09-19,Start hospital police card animal power.
7419,2048,1493.69,Withdrawal,2024-05-06,Natural risk claim.
7420,8328,6805.71,Debit,2024-11-23,Large other front.
7421,5785,329.94,Credit,2024-04-26,Pull like tough can.
7422,762,4400.59,Deposit,2022-11-13,More where current board.
7423,1413,9302.73,Transfer,2021-02-28,Little well address eat keep TV move despite.
7424,7608,705.43,Credit,2021-08-31,Kind trade accept political student a.
7425,8585,2689.88,Transfer,2021-09-25,Light couple world fish soldier describe eye draw.
7426,7969,3621.03,Withdrawal,2024-05-08,Remain different song.
7427,8210,9731.79,Credit,2021-10-31,Fall room light.
7428,8371,9952.17,Credit,2023-05-21,Decide still sign fly only dream.
7429,9186,3870.3,Deposit,2024-01-03,Contain day owner TV board exist experience list.
7430,9189,7774.08,Deposit,2020-09-10,Story food mention loss.
7431,5103,7228.52,Deposit,2023-07-13,Direction happy organization edge build ability choose.
7432,3021,96.46,Transfer,2021-01-11,Since front treatment.
7433,5268,9345.66,Withdrawal,2025-02-08,Treat nice identify she coach art various.
7434,8982,2731.91,Transfer,2021-09-25,Sea affect what available agreement.
7435,4108,986.89,Deposit,2021-10-23,Teach through chair the third matter.
7436,7727,1853.5,Credit,2023-05-30,Newspaper find law security upon reason.
7437,7003,4140.83,Debit,2022-03-19,And perform either talk enjoy everything.
7438,2885,3288.15,Debit,2020-12-31,True member white let.
7439,2410,1520.34,Deposit,2023-08-07,Personal feeling ask moment unit ever president her.
7440,2719,4235.03,Credit,2023-06-27,Create although third but.
7441,1094,4796.22,Refund,2025-04-13,Edge investment mouth town none capital eye.
7442,4875,5250.8,Refund,2022-04-18,Shake both painting get hotel environment.
7443,4148,475.27,Withdrawal,2022-01-01,Health feeling recognize contain young together anything.
7444,1932,9941.83,Refund,2024-10-24,Investment TV add performance year.
7445,498,9776.27,Transfer,2022-11-10,Strategy worker sister yard base.
7446,4028,6527.87,Credit,2020-09-04,Test throughout beautiful stock why seek how building.
7447,8181,2247.21,Deposit,2024-12-15,Campaign almost such service hour law cultural.
7448,891,3546.67,Credit,2020-11-16,Agent pattern friend anyone.
7449,6453,5003.22,Refund,2024-12-28,Thus commercial on onto.
7450,7704,4291.87,Deposit,2023-04-18,Money relate century together common car common.
7451,6295,4799.01,Credit,2022-07-12,Guess professional data future identify beyond.
7452,8229,3763.27,Transfer,2025-03-24,Learn natural dark military.
7453,3452,290.19,Credit,2022-11-16,Three her charge line group else hotel.
7454,4621,5096.14,Debit,2022-11-02,Ever several country event.
7455,3685,6585.68,Withdrawal,2021-10-21,Serve debate article total.
7456,1911,562.4,Debit,2022-04-06,Say exist believe ground.
7457,1548,1350.99,Deposit,2023-07-09,Civil hear figure state.
7458,4817,3708.3,Debit,2022-06-30,Effect who special high difficult cup actually.
7459,4394,4005.38,Refund,2024-05-27,Describe about move.
7460,9174,5000.42,Credit,2021-08-17,Key us ok institution.
7461,8417,3925.7,Transfer,2024-12-19,Law author per social specific grow term represent.
7462,4191,2372.82,Credit,2021-02-15,Structure allow hit financial wish sport main.
7463,2024,7273.64,Withdrawal,2023-10-01,Director bad base stay fight catch all.
7464,3617,3453.44,Refund,2020-11-16,Picture else quality fine.
7465,4438,7739.2,Deposit,2024-06-26,Crime around son even paper.
7466,8647,1941.7,Debit,2022-11-26,Finish institution person per everyone only.
7467,1661,5392.74,Debit,2025-01-23,Go bad make question.
7468,2786,1161.4,Withdrawal,2024-04-21,Because move approach soldier kind help claim meeting.
7469,915,9832.88,Debit,2024-06-15,Some energy base maintain station can.
7470,272,9868.24,Transfer,2023-11-09,Enough decade quite stock.
7471,8095,2442.44,Debit,2024-09-16,Level certain out prove view.
7472,2362,3292.81,Refund,2024-03-27,Decision decide join entire military quality.
7473,4881,6028.91,Refund,2023-09-06,Rule serve want project PM fly.
7474,1229,1653.62,Credit,2020-09-17,Station top certain ask.
7475,1490,767.02,Refund,2024-05-10,Like number north cell.
7476,3380,5179.63,Refund,2023-05-31,Air street strategy practice material support mouth.
7477,1369,5735.18,Deposit,2021-03-08,Score company significant major husband.
7478,559,6960.37,Refund,2021-05-18,Worker sound fear against team again available control.
7479,2920,1291.43,Refund,2021-11-12,Paper between respond rather according somebody billion.
7480,5751,6298.49,Debit,2022-10-20,Describe red the particular turn growth cut.
7481,3120,8705.54,Transfer,2023-08-14,Remain card ready her recently floor.
7482,7230,6258.8,Transfer,2022-09-25,North agree although oil reason story relationship.
7483,7417,4312.98,Credit,2024-01-27,Generation most partner produce school.
7484,5196,8301.0,Transfer,2022-02-16,Professor age cut vote dream rather.
7485,9338,7547.64,Withdrawal,2022-09-20,Character trade hair boy between.
7486,5899,6053.86,Transfer,2025-05-12,Type gun wear take.
7487,3938,61.08,Transfer,2024-07-08,Development over trouble event black.
7488,9643,1033.26,Transfer,2023-02-16,Behind story your article my choose allow.
7489,836,1346.99,Deposit,2021-04-06,Many term commercial onto statement family.
7490,2358,159.68,Deposit,2024-06-27,Product them fast wish particularly past society.
7491,2363,2969.13,Withdrawal,2022-06-09,Real natural administration almost run require although.
7492,7178,2679.82,Refund,2023-07-01,Mean want live ten cover.
7493,6150,5289.66,Credit,2025-03-28,Drug season day social card.
7494,2336,4729.49,Withdrawal,2022-01-29,Clear room special perhaps.
7495,3164,8306.14,Deposit,2023-11-04,Near card authority rich anything make degree.
7496,8513,8782.36,Transfer,2025-01-07,Low article body chair present course.
7497,6739,4869.75,Refund,2024-11-03,Office politics day eat seven policy.
7498,9697,2504.68,Deposit,2022-01-09,When appear serve do herself.
7499,7897,9636.12,Withdrawal,2022-04-16,Low treat close feel bill wrong.
7500,9315,6646.87,Refund,2020-12-16,Some main scientist story society whatever face.
7501,1691,2415.02,Debit,2022-03-22,Land community station president bar make ago trouble.
7502,605,1865.82,Credit,2022-11-11,Military recently music study group whom agreement.
7503,5895,6595.0,Credit,2023-06-14,Picture medical prepare clear.
7504,4836,6268.78,Debit,2020-11-04,Agreement brother improve measure finally professional.
7505,2188,2153.78,Debit,2022-10-30,Growth field also kind couple fast.
7506,8294,6811.28,Debit,2023-02-07,Action reality stock any analysis.
7507,3209,2974.47,Credit,2022-11-12,Really any can common poor old.
7508,4967,6269.68,Withdrawal,2025-02-09,White save girl tonight consumer.
7509,1725,6017.22,Refund,2021-12-16,Someone each history administration.
7510,7541,5456.28,Withdrawal,2022-05-15,Discover population put word.
7511,9912,3365.3,Transfer,2024-11-09,Design computer order lay lot minute.
7512,8429,9874.04,Debit,2022-07-23,Too story close region me.
7513,9729,6700.39,Transfer,2023-02-16,Key understand student if something around far week.
7514,8905,6055.19,Credit,2023-12-05,Market full bag strong.
7515,5241,643.41,Transfer,2021-06-25,Look mention human year.
7516,1704,2631.29,Credit,2021-05-02,Fall time fire reflect factor long decade.
7517,6491,9988.54,Debit,2024-06-23,We car especially parent fight bank cost four.
7518,3172,3669.04,Deposit,2023-07-11,Receive reach part thus movement.
7519,5518,5717.29,Transfer,2024-01-12,Trial teach good conference ask rich want explain.
7520,1515,916.25,Refund,2023-04-04,Receive apply local go hit fire so.
7521,2591,1379.81,Credit,2020-10-16,It decade always me establish necessary.
7522,9985,639.91,Deposit,2023-01-20,Either smile morning something reach practice car.
7523,3827,1845.73,Credit,2021-04-11,Take very medical rule without guy when.
7524,4855,127.65,Deposit,2025-05-23,Piece matter physical top dream hard.
7525,1742,4460.31,Refund,2021-12-11,Successful traditional nature piece form.
7526,4282,9486.81,Withdrawal,2021-04-12,Difference value trip her adult.
7527,2793,736.8,Credit,2020-11-28,Service design skin poor can scene.
7528,9318,6080.31,Debit,2024-04-13,Case trouble near almost.
7529,8878,8169.95,Refund,2025-01-16,Carry model crime beautiful them strong finally.
7530,5671,9026.24,Withdrawal,2021-08-13,Often partner country center.
7531,1472,2825.35,Transfer,2024-05-13,Always audience current member.
7532,6254,3651.0,Refund,2025-02-21,Interesting themselves career social investment project.
7533,2611,2350.06,Credit,2025-04-15,Heavy year kitchen author nation skill number them.
7534,6076,6944.29,Debit,2022-02-13,Respond together yet even somebody future.
7535,2753,1827.64,Refund,2020-08-20,Treatment article until arrive agreement benefit.
7536,3564,3461.71,Deposit,2024-05-27,Off edge entire image.
7537,8036,2038.06,Deposit,2024-10-15,Real citizen tell white play.
7538,3548,3395.73,Withdrawal,2021-09-25,Deep southern election late position many conference.
7539,3276,2489.92,Transfer,2023-05-18,Parent discuss you front.
7540,8718,2653.43,Debit,2021-11-30,Inside morning price produce street.
7541,2338,8640.19,Debit,2022-02-23,Choose down decade most really physical.
7542,7378,7179.52,Refund,2024-08-16,Return place for of.
7543,7330,4656.74,Withdrawal,2025-04-10,Whatever analysis role city wind.
7544,3381,2613.89,Refund,2025-01-11,Significant serve machine.
7545,9817,970.07,Transfer,2021-07-16,Carry Mrs go them.
7546,8548,9094.94,Transfer,2021-04-09,Quite continue produce across lose.
7547,7502,4629.57,Transfer,2024-02-05,Lose us receive character.
7548,5846,3001.46,Credit,2021-11-18,Civil ground model though see simple necessary which.
7549,3241,2673.54,Transfer,2023-10-16,Including local theory police fish anyone policy statement.
7550,7524,6857.97,Debit,2024-01-24,Fish resource continue.
7551,9778,5200.07,Credit,2020-08-22,Size husband sell no argue should.
7552,8129,7960.72,Withdrawal,2021-11-06,Themselves grow drive resource.
7553,9263,1237.3,Debit,2022-11-16,Recent quite front lay after main.
7554,1070,1989.61,Debit,2022-02-06,Yet material large money happen meeting official she.
7555,1286,4875.9,Transfer,2024-09-12,Share when exactly her.
7556,4216,5033.58,Deposit,2025-04-07,With picture defense.
7557,2305,1045.85,Deposit,2024-05-15,Draw land just describe feeling movement.
7558,5100,324.03,Refund,2024-10-23,Candidate learn office total.
7559,8926,1518.84,Deposit,2021-03-12,Might then film carry decision.
7560,7574,6934.83,Credit,2024-01-24,Cell describe too tough.
7561,6515,8943.81,Credit,2025-02-07,Trouble someone democratic recently hard rest.
7562,7414,5187.42,Deposit,2024-12-11,Sing account investment example.
7563,517,6754.67,Credit,2024-09-04,Style perhaps course cost either.
7564,3127,3385.13,Withdrawal,2024-10-29,White early put cold such.
7565,4316,1152.19,Credit,2024-07-28,Again recent much group get billion.
7566,7710,3010.36,Credit,2024-04-17,Support smile she any door lead.
7567,8457,2127.42,Deposit,2021-12-29,Air face discuss decade.
7568,33,4707.34,Refund,2023-07-09,Home agent born same.
7569,83,2654.88,Credit,2022-07-06,Easy measure source.
7570,5107,2713.2,Transfer,2025-01-22,Less care professional coach heavy.
7571,5531,5528.46,Debit,2023-10-27,Similar especially laugh figure.
7572,6676,8122.21,Debit,2022-06-19,Mean get report decade take.
7573,5326,1872.81,Transfer,2021-03-12,So throw just future.
7574,5859,9143.4,Transfer,2024-04-11,Well pattern understand hot might.
7575,2526,4737.41,Withdrawal,2023-03-20,Question series house.
7576,6718,217.2,Transfer,2022-08-01,Only early billion force rather bank.
7577,2560,3060.53,Debit,2022-10-22,Religious strong authority manage vote hospital.
7578,9190,1563.86,Refund,2024-04-11,Generation back agreement approach defense.
7579,8798,1984.85,Debit,2022-12-22,Magazine home central great watch course.
7580,2217,3126.19,Debit,2024-12-24,Region however response again.
7581,1925,5258.58,Withdrawal,2024-09-10,Century near above hundred traditional from value.
7582,2290,1554.82,Debit,2024-10-09,Environment sport raise guess.
7583,5163,4286.18,Refund,2023-01-12,Live in animal fast can glass side.
7584,9882,581.53,Deposit,2020-12-02,Toward page year space Mrs after away.
7585,6718,7962.57,Deposit,2022-03-29,Space we everyone mother.
7586,6435,1240.7,Refund,2020-11-26,Player moment compare high wear prove.
7587,6398,3664.73,Withdrawal,2024-01-14,Ground vote believe fund.
7588,3462,13.76,Deposit,2022-08-15,Feeling yet much describe try once large.
7589,894,3600.92,Transfer,2022-07-14,Leg near shake watch why.
7590,2412,9717.25,Debit,2023-05-11,Tree seven guess reason wide individual.
7591,5257,3167.76,Transfer,2024-04-27,Because brother campaign continue.
7592,9931,642.07,Withdrawal,2022-03-13,Loss reality according music little war organization.
7593,6096,8057.75,Credit,2020-12-03,Others explain cultural responsibility fight in even.
7594,4353,6626.42,Transfer,2021-09-01,Authority scientist reveal treatment.
7595,6183,1409.42,Refund,2025-01-25,Center analysis true be order sell catch.
7596,2855,559.68,Withdrawal,2024-03-11,Institution few current important kid else fire.
7597,4251,2412.7,Withdrawal,2024-07-09,Per particular care record cause.
7598,5719,6000.02,Credit,2021-02-24,Power market guess event.
7599,3959,4799.53,Credit,2023-04-18,Card sell forward pressure trip important.
7600,4126,277.76,Withdrawal,2021-10-26,But rest glass hundred off wide.
7601,6702,5292.1,Debit,2020-12-28,Likely picture program dinner purpose need hope.
7602,2042,2546.26,Credit,2024-05-27,Safe despite always boy about.
7603,2241,9147.47,Debit,2020-09-26,Who as nothing.
7604,1722,1908.15,Credit,2022-06-06,Quite already only quite.
7605,2889,3149.71,Debit,2024-08-26,Hotel executive join rock.
7606,1676,5508.35,Deposit,2021-07-14,Night scene work produce record off.
7607,6867,4392.37,Deposit,2021-08-29,Leader word contain hit leader.
7608,1305,4354.58,Withdrawal,2022-03-03,Huge finally take race glass painting.
7609,1524,323.76,Debit,2023-02-09,Including watch heart.
7610,8317,295.87,Credit,2022-03-21,Only gas religious true enough figure.
7611,4234,1879.79,Refund,2023-08-23,Why second card quality maintain while never cold.
7612,8381,4513.07,Withdrawal,2023-08-28,Interesting than citizen room see arm.
7613,1272,6243.49,Refund,2023-07-20,Pass discussion will five enter.
7614,4918,4748.3,Debit,2024-07-09,Chair throughout part whom.
7615,8210,2438.32,Refund,2024-05-15,Involve pretty act skill Mr purpose.
7616,2865,5221.57,Deposit,2025-07-26,Detail better international.
7617,3148,4685.02,Debit,2020-12-09,Want maybe here fear.
7618,5631,4997.68,Transfer,2022-01-15,Activity knowledge above hand kid argue.
7619,4637,1465.28,Withdrawal,2022-11-29,Weight civil commercial end strong study.
7620,7608,8276.27,Debit,2020-11-07,Traditional per after trip operation design nor.
7621,1544,4386.0,Debit,2021-11-06,Mean charge responsibility matter through.
7622,7106,6034.31,Debit,2023-11-29,Human great fight success claim husband would.
7623,6590,8808.99,Credit,2022-09-30,Staff order difference everything subject.
7624,1116,5981.35,Transfer,2021-04-08,Home thank boy usually open.
7625,8585,1303.58,Deposit,2021-12-23,Carry receive direction art model.
7626,730,8154.81,Debit,2024-08-22,Event since high require modern fish.
7627,3560,6451.84,Refund,2024-12-08,Wife either other can.
7628,2037,2392.28,Debit,2025-06-12,She simple family compare decade yeah however.
7629,9760,698.56,Deposit,2024-09-12,Six day career factor view direction.
7630,6003,8323.82,Transfer,2023-01-22,Together sense own.
7631,3182,1457.76,Withdrawal,2021-12-04,Him section dream gun me region once.
7632,8606,4438.72,Deposit,2022-08-11,Pull to marriage party understand beautiful.
7633,8052,9109.71,Credit,2021-08-25,Final high able action half main third.
7634,3040,7870.62,Withdrawal,2025-03-07,Fact never film.
7635,6697,5644.56,Transfer,2024-07-08,Upon find thus.
7636,162,9803.64,Deposit,2024-11-04,First want old either might hope series pull.
7637,1498,9757.06,Refund,2022-07-28,Sell send thing beautiful.
7638,8968,7422.72,Transfer,2022-01-16,Teach seven same news yeah.
7639,3793,7874.02,Deposit,2023-04-29,Sell paper reduce car inside.
7640,1724,7136.45,Withdrawal,2023-07-03,Affect single turn draw yard surface.
7641,5819,6898.32,Deposit,2021-08-03,Form will enjoy Mrs technology really if.
7642,5670,6953.13,Withdrawal,2024-10-05,Eight then stand rather doctor.
7643,4582,914.57,Deposit,2022-07-12,Upon let consider task top pretty small doctor.
7644,9710,9751.74,Withdrawal,2021-09-27,Vote outside career would keep heavy live.
7645,4098,5617.25,Credit,2023-04-24,Happy machine time debate down today.
7646,5770,5654.79,Refund,2021-11-27,Paper follow painting them.
7647,8248,2096.94,Refund,2022-12-09,The word unit exactly.
7648,9195,8748.84,Debit,2022-08-20,May market television pick act travel especially.
7649,932,4607.42,Credit,2025-03-01,More PM shoulder produce whole within.
7650,8050,3744.91,Refund,2025-02-06,Seat nature young while.
7651,6544,9055.94,Refund,2021-08-21,Face nearly support.
7652,6743,7891.26,Deposit,2023-02-09,Wonder on player despite.
7653,148,2133.23,Deposit,2022-09-02,Marriage whose race half group to interesting.
