TRANSACTION_ID,CUST_ID,AMOUNT,TRANSACTION_TYPE,TRANSACTION_DATE,DESCRIPTION
2449,341,9132.95,Transfer,2021-03-07,Kind prove couple.
2450,9103,90.18,Debit,2023-03-14,Wish when possible painting.
2451,6236,386.9,Withdrawal,2021-10-02,Sit measure must join life consumer ball.
2452,8148,6123.84,Transfer,2023-12-17,Defense feeling bad although.
2453,4420,6323.92,Withdrawal,2020-12-19,Bit role develop impact too drop.
2454,4350,4516.19,Credit,2025-01-11,Charge player state mother and shoulder.
2455,349,7810.39,Refund,2022-01-11,Goal young media during worker less.
2456,2119,5890.29,Transfer,2024-09-10,Help station hear finally.
2457,89,4210.78,Credit,2023-01-10,Available everything region simply admit measure.
2458,3573,2219.84,Deposit,2022-10-06,Able able issue treat once.
2459,7493,8170.06,Transfer,2025-05-04,Understand along individual on require feel cultural.
2460,8633,8761.1,Withdrawal,2023-09-28,Number window wonder way no beyond.
2461,6534,300.35,Withdrawal,2024-01-06,College sit laugh least.
2462,8391,1815.93,Transfer,2024-12-01,Indicate lawyer goal father eat toward much.
2463,9774,719.24,Refund,2025-05-25,No commercial within outside fine.
2464,4722,3231.6,Credit,2023-08-25,However during soon.
2465,4880,5326.63,Refund,2022-08-28,Hair industry put no important here.
2466,3663,4768.67,Credit,2021-08-17,Carry off small color stage from throughout.
2467,8377,4662.81,Credit,2021-10-20,Professor which raise get arrive president.
2468,2084,3253.75,Debit,2020-10-16,Technology central traditional author.
2469,8852,1031.79,Withdrawal,2024-11-20,Community line beat mention plant could include.
2470,7872,899.95,Transfer,2021-11-12,Political argue only cover Democrat.
2471,4066,2295.73,Credit,2020-08-12,Pick blood according blood.
2472,1571,1499.42,Credit,2021-02-06,They particularly black hand.
2473,2329,2209.65,Credit,2020-10-30,Health something different we perhaps such.
2474,262,3144.76,Refund,2025-04-26,Dinner activity change more provide charge.
2475,2276,1407.36,Transfer,2021-07-31,Alone son out style president.
2476,226,5358.35,Credit,2025-05-23,Indicate safe new gun prevent see.
2477,5291,8177.41,Debit,2024-10-06,Value serious whole big its.
2478,9421,8855.31,Deposit,2020-09-14,Less often culture.
2479,1644,1711.58,Withdrawal,2023-01-07,East east increase field for.
2480,28,4161.41,Transfer,2025-05-24,Pressure while address mouth or fund.
2481,3793,4567.15,Deposit,2025-04-01,Imagine perform prove option drop.
2482,1905,3929.71,Debit,2020-07-27,Clear build moment large radio show individual.
2483,542,2565.79,Withdrawal,2024-06-13,See company produce side add town fill.
2484,4546,3329.4,Refund,2021-09-10,Impact from wait cut apply direction.
2485,4933,2501.63,Transfer,2020-08-11,Sure new such themselves seven factor card.
2486,3766,8498.97,Credit,2024-06-11,Today age chair more marriage democratic allow.
2487,4244,7605.93,Credit,2024-02-17,Hold huge want.
2488,4019,6162.74,Credit,2024-07-31,So safe head away finally.
2489,552,482.31,Withdrawal,2021-07-12,Difference music few.
2490,1018,2109.12,Credit,2021-07-03,Under term audience this too.
2491,5752,5385.62,Debit,2022-02-02,Film total project the grow share.
2492,7220,2498.85,Deposit,2021-09-26,War animal audience lawyer somebody watch turn.
2493,3454,5013.91,Refund,2024-08-17,Never phone night cut front ago before.
2494,1029,4162.09,Refund,2023-12-23,Risk condition author position.
2495,896,4125.47,Refund,2023-11-07,Consider yard character organization camera.
2496,3549,3756.55,Credit,2023-08-06,Room these game.
2497,9366,4462.1,Deposit,2022-02-08,After information central artist federal week.
2498,6849,4313.88,Deposit,2024-05-30,Surface page mention focus measure.
2499,534,7642.3,Deposit,2021-03-08,Back leader determine technology idea.
2500,7912,6485.05,Transfer,2020-12-05,Cost threat attack medical break floor.
2501,2929,8083.43,Credit,2020-10-03,Feel great maybe practice.
2502,1635,6523.97,Debit,2023-05-17,Project so try agent.
2503,5738,3058.56,Refund,2024-10-13,Not many up.
2504,2568,4067.11,Refund,2022-06-20,Show exist summer fast animal guess beautiful.
2505,422,4268.35,Debit,2024-07-14,Rich approach help most sea night.
2506,8446,7631.17,Credit,2023-01-12,Position wonder college degree.
2507,6492,6429.96,Withdrawal,2022-11-08,Professional option rest city anyone man short.
2508,3926,9059.89,Debit,2023-10-15,Special real military control per dog change.
2509,7775,9250.4,Withdrawal,2020-08-24,Form test prevent color.
2510,5422,4120.64,Transfer,2021-08-16,Reveal value protect send couple course.
2511,6981,5708.73,Debit,2021-12-11,Child keep scene improve grow.
2512,985,6048.09,Withdrawal,2024-07-10,Beautiful drug bar relationship pretty she.
2513,9956,1331.82,Debit,2024-10-04,Positive way majority industry such case.
2514,3608,7338.98,Deposit,2023-12-22,Because data size magazine.
2515,8383,5225.29,Refund,2025-05-24,Catch occur father probably girl.
2516,9424,9383.24,Transfer,2025-01-03,Memory else job.
2517,9179,9231.96,Transfer,2025-06-04,Town maybe those follow interesting.
2518,8988,3753.09,Deposit,2024-02-28,Against report suffer community shoulder.
2519,698,1139.11,Refund,2022-10-28,Develop child through network respond strong candidate either.
2520,5267,4762.99,Withdrawal,2020-10-17,Subject clear half result.
2521,2756,9491.51,Transfer,2023-08-21,Always indicate generation environmental recognize.
2522,9409,1409.42,Credit,2024-10-23,Recognize Mr election only sometimes.
2523,3434,9567.0,Withdrawal,2023-04-08,Above we car a.
2524,2109,213.3,Withdrawal,2023-01-08,He true our every.
2525,6220,5917.08,Deposit,2021-02-11,Politics officer guy shake give also as.
2526,4138,359.16,Withdrawal,2020-10-29,Expert across international there suggest recent.
2527,8952,975.92,Withdrawal,2024-03-14,Seat science civil already.
2528,3810,9792.48,Refund,2020-08-19,Couple personal bag plan major everybody.
2529,1424,9198.34,Debit,2022-01-23,Machine individual minute mean week central.
2530,5230,2930.68,Deposit,2020-09-04,Hotel others important fast term lead reason.
2531,7787,2810.26,Deposit,2023-11-11,Weight quality never reveal turn center office.
2532,7974,8673.12,Debit,2021-09-19,Maintain bag far she.
2533,5207,9080.52,Deposit,2023-12-24,Knowledge right run side.
2534,5288,1621.21,Transfer,2025-05-28,Everyone environment station western simple whom cover task.
2535,3583,7865.75,Deposit,2025-04-06,Paper financial finish number best.
2536,8099,1438.83,Debit,2022-01-26,Current certainly by above stop.
2537,8207,7671.78,Deposit,2021-10-12,Question question any.
2538,2073,549.47,Credit,2021-12-13,Skin attorney dark sound experience edge.
2539,396,4378.1,Deposit,2024-06-24,Wish political simply able sit adult hope.
2540,2949,6878.78,Transfer,2023-09-02,Would health still.
2541,9481,5551.69,Transfer,2021-07-02,Southern in account medical best him stand.
2542,4564,3922.04,Debit,2022-09-18,Hope quality customer stop drug floor maintain.
2543,8863,4029.21,Transfer,2024-01-23,Rate fill fly you return already.
2544,6526,8196.57,Transfer,2023-09-17,Ok institution shake collection live.
2545,3658,7517.82,Credit,2020-10-26,Yeah team new feel.
2546,2456,6533.41,Deposit,2023-05-01,Statement themselves democratic lose free million.
2547,9263,6610.84,Deposit,2025-07-20,Whose pass response material.
2548,6148,530.06,Deposit,2022-08-06,Standard inside inside.
2549,132,7812.98,Refund,2024-11-02,Dream gas foot site nation.
2550,3841,2523.57,Withdrawal,2025-02-22,Bed any account assume peace movie amount.
2551,377,1992.69,Refund,2023-02-04,Deep important put side at box.
2552,7544,423.72,Deposit,2024-03-14,Interest do treatment remain pull.
2553,5338,2560.63,Deposit,2025-01-21,Interview program visit buy model discussion assume.
2554,5836,594.86,Transfer,2024-04-11,President billion strategy include list.
2555,6668,2249.82,Refund,2021-11-24,Draw music chance office special.
2556,8993,753.0,Transfer,2023-11-10,Themselves leader hear join up organization learn kid.
2557,7498,7942.13,Transfer,2025-06-22,Everyone everyone executive wait management front notice.
2558,2922,9431.62,Transfer,2023-03-10,Key operation special example mother.
2559,6548,6782.86,Withdrawal,2022-10-03,Few describe investment opportunity.
2560,2017,4145.48,Withdrawal,2025-02-11,Determine late dream my reason catch too author.
2561,5761,5750.28,Transfer,2023-04-09,Staff such part ever him south indeed situation.
2562,7250,6757.0,Refund,2023-01-23,Paper word itself level long.
2563,2944,7369.2,Deposit,2021-10-20,Must four what born though.
2564,1969,8274.8,Credit,2022-08-25,Discussion friend address improve only understand old.
2565,8571,6578.65,Transfer,2024-09-23,Something south interesting painting run party.
2566,9289,305.14,Withdrawal,2024-04-14,Tough within improve coach how see.
2567,4454,3971.92,Deposit,2023-10-31,Measure free citizen give.
2568,7943,8126.59,Deposit,2023-08-23,Station behind whole treat sometimes politics city month.
2569,7637,8048.98,Withdrawal,2024-11-03,Wait individual rule subject.
2570,2719,8680.36,Credit,2022-12-21,Owner party ok oil.
2571,6466,3890.7,Refund,2020-12-26,Senior key collection both.
2572,4256,8778.23,Credit,2023-11-24,Garden have start require everything really action.
2573,8552,1022.36,Refund,2023-11-05,Recognize support population stop husband me.
2574,7013,3840.93,Credit,2020-10-16,Base owner out decade.
2575,8703,3513.07,Debit,2022-11-09,War above new note machine baby prove.
2576,3999,9777.77,Withdrawal,2021-02-15,Focus service myself hot peace all.
2577,8676,645.53,Refund,2023-05-26,Conference information either wait weight skill past.
2578,6840,4713.99,Refund,2021-03-09,Some third north son.
2579,1623,2360.61,Withdrawal,2023-12-06,Rule top indeed final realize.
2580,1266,2643.06,Deposit,2021-05-15,Interesting specific because seem sea.
2581,9083,4807.36,Deposit,2024-02-04,Think likely church thank.
2582,8048,5217.45,Withdrawal,2024-11-17,Like lawyer special yeah cause from have.
2583,2629,397.37,Refund,2021-05-25,May billion machine practice training success.
2584,3858,1364.2,Refund,2024-06-12,Media media civil win me throughout.
2585,2158,581.57,Credit,2024-03-06,Else matter her audience develop.
2586,8960,5011.79,Withdrawal,2023-05-17,Type several space agreement.
2587,958,2707.27,Deposit,2021-12-30,Theory better heart rich a involve large.
2588,143,8752.5,Refund,2021-04-13,Culture end beautiful face include.
2589,6794,5846.49,Transfer,2021-03-01,Coach everybody local cut short again unit.
2590,8608,1345.79,Credit,2022-01-24,Within race with child clear three.
2591,9283,7760.1,Deposit,2023-01-01,Individual risk support per.
2592,472,4980.83,Debit,2022-06-26,Read deep art someone.
2593,1610,8688.49,Deposit,2020-08-16,Guy over you yeah voice daughter sense mean.
2594,282,1373.85,Debit,2024-01-19,Pass bed run job carry experience physical.
2595,7620,4540.14,Refund,2022-11-29,Range relate of catch purpose not.
2596,4786,593.49,Credit,2024-01-07,Attention fight technology different painting crime what in.
2597,9696,4444.22,Refund,2023-09-06,Space our success think challenge kind.
2598,7850,4689.42,Debit,2024-05-25,Meeting serious single main staff explain left.
2599,4883,365.95,Deposit,2022-07-29,Stock through behavior organization worry focus east.
2600,4090,3635.46,Deposit,2023-01-23,But write only discover.
2601,3991,4164.32,Credit,2024-04-26,Election however right around.
2602,2349,3370.65,Withdrawal,2020-10-30,Shoulder just article early.
2603,4098,8469.54,Debit,2022-05-27,Laugh weight country still indicate.
2604,8335,8679.92,Credit,2021-07-20,Sound drive near.
2605,5526,4704.74,Withdrawal,2021-11-26,Something capital create arrive toward.
2606,9665,4222.29,Debit,2022-07-10,I firm whatever court middle Democrat.
2607,7521,9106.38,Deposit,2023-01-16,Appear open work heavy research single whole.
2608,2244,1897.87,Transfer,2022-10-09,Culture break measure quickly rich look.
2609,7782,1824.41,Deposit,2025-03-22,Lead degree lose usually.
2610,98,7557.67,Credit,2020-08-26,Section sign eight strategy back remain safe.
2611,9356,8831.96,Transfer,2021-01-24,Across skill create able camera weight provide special.
2612,1635,932.42,Refund,2022-02-23,Minute skin vote kitchen lot particularly.
2613,4633,7574.41,Withdrawal,2023-11-16,Game shake hard effort talk tax then.
2614,5545,9476.05,Credit,2022-03-08,Standard air fund just occur almost sign environmental.
2615,8388,3525.02,Deposit,2025-05-31,Alone scene wife just surface environmental.
2616,1925,8295.02,Debit,2021-02-13,Read however agree city pass sister authority.
2617,8052,3635.56,Deposit,2023-07-31,Chance really environmental Mr.
2618,3256,1398.2,Debit,2021-04-11,Smile attorney white family girl look.
2619,4059,2213.9,Refund,2022-06-02,Issue likely final letter product.
2620,8428,3594.68,Refund,2021-02-15,Free single just itself game.
2621,3641,8497.25,Transfer,2023-07-04,Ten live approach green anyone season may.
2622,3830,6818.2,Refund,2022-05-26,And single animal then discussion.
2623,2492,477.67,Credit,2021-09-29,Leader send blood special finish exist certainly.
2624,8086,6132.02,Withdrawal,2024-01-21,Number guess instead lay.
2625,9301,1850.65,Refund,2023-07-18,Particularly across during how security parent final.
2626,8568,8719.14,Withdrawal,2021-10-05,Child wide those check between.
2627,2476,635.96,Credit,2021-07-21,Force base laugh just so win.
2628,9895,2355.42,Refund,2025-02-24,Letter produce character kitchen your adult character.
2629,2201,5983.09,Deposit,2021-06-26,Inside condition little every black.
2630,8169,7531.07,Deposit,2022-10-13,Lead interview collection difference step.
2631,8831,6617.96,Refund,2024-05-11,Our matter art save foot training trip pretty.
2632,9235,9469.77,Transfer,2022-07-09,Thus heavy use dark.
2633,7411,3735.04,Deposit,2023-02-27,Idea allow PM present country.
2634,5691,2870.0,Withdrawal,2023-05-03,Decide old four value central down area.
2635,2807,6524.13,Credit,2024-12-12,Fear hotel customer everyone.
2636,7984,4230.41,Refund,2020-08-11,Discussion six set raise keep politics.
2637,1328,9573.92,Withdrawal,2023-08-16,But information mouth likely as receive.
2638,2971,4016.27,Withdrawal,2022-07-23,Leader gun alone analysis artist.
2639,4094,8356.89,Withdrawal,2023-11-04,West choose next popular out close.
2640,9264,3273.59,Withdrawal,2023-02-09,Building your return do.
2641,8212,2881.25,Transfer,2025-01-14,Head anyone environmental learn able fine forget.
2642,6312,5802.16,Withdrawal,2022-12-26,Prevent answer leg strategy economy.
2643,932,7149.1,Transfer,2023-07-25,Common or represent catch each share.
2644,1571,1971.72,Credit,2020-12-21,Manager onto be.
2645,3740,2856.29,Debit,2023-12-23,Poor land car difficult news catch.
2646,8582,2032.12,Credit,2020-11-30,Lot all conference analysis style heart research.
2647,8859,1696.56,Deposit,2020-09-30,Difficult near food executive live.
2648,6055,3092.25,Withdrawal,2024-06-02,Trade quite if place.
2649,1296,7643.87,Debit,2023-02-18,Because particularly toward keep social cost else help.
2650,6581,5785.33,Credit,2025-04-28,Mention and child.
2651,2586,3128.81,Debit,2024-10-10,Along land value.
2652,3127,7849.7,Deposit,2021-09-10,Activity practice school.
2653,6793,8297.79,Withdrawal,2023-06-18,Focus type rock writer house world me.
2654,5529,248.82,Deposit,2023-05-05,Far available property scene.
2655,3329,6864.16,Debit,2023-11-14,Some standard future discover.
2656,5177,8552.33,Deposit,2024-03-04,Help capital yourself meeting decision imagine.
2657,6928,33.83,Credit,2023-07-16,I into capital kid number realize lead.
2658,8105,8386.85,Refund,2024-07-07,Data away face check able summer significant per.
2659,9600,7049.0,Deposit,2024-01-20,Live play team again.
2660,7402,4410.89,Withdrawal,2021-03-27,Say personal almost page bad.
2661,2901,6395.26,Debit,2023-05-01,Economic claim culture tough house.
2662,7412,6844.2,Credit,2020-10-01,Every friend Republican dog improve red.
2663,1594,4179.57,Refund,2023-02-28,Kind factor treat outside specific skin.
2664,4031,7980.21,Deposit,2023-07-01,Owner stay yet want region change first often.
2665,5160,361.08,Deposit,2022-09-29,We even behavior piece hope.
2666,650,8130.51,Debit,2022-05-17,By sense true alone region teacher avoid.
2667,1492,3827.12,Withdrawal,2023-12-14,Save lead alone not.
2668,9108,62.61,Credit,2023-12-03,Somebody home later coach event.
2669,3614,9271.76,Withdrawal,2023-04-22,Chair history sport dinner our already common.
2670,8892,7382.71,Withdrawal,2021-02-28,Himself there political likely.
2671,7995,8460.37,Credit,2021-12-29,Certain then window figure recently low leave those.
2672,7172,4752.62,Credit,2025-06-16,Purpose try light argue.
2673,6700,9421.19,Deposit,2020-10-20,Billion six him interest deep feeling condition.
2674,3044,1052.94,Deposit,2024-04-21,Her attention tonight available effort order.
2675,5840,1533.28,Withdrawal,2021-06-21,Strong charge walk current mouth result specific.
2676,1144,3809.09,Refund,2024-07-09,Public environmental start nearly any laugh.
2677,8602,6673.85,Withdrawal,2022-03-10,Research wonder president draw Republican analysis.
2678,6694,3772.16,Withdrawal,2024-05-01,Second great series.
2679,1026,344.6,Deposit,2024-12-12,Dinner black meeting.
2680,3985,5125.41,Debit,2024-03-21,Pass up base head lay glass camera.
2681,2014,497.67,Withdrawal,2025-07-25,Result southern last.
2682,6230,2129.09,Withdrawal,2023-09-27,Study value among of wind sort.
2683,6767,9193.68,Debit,2023-01-14,Produce production cost month vote environmental employee.
2684,7133,5121.6,Refund,2023-11-17,Religious live citizen born drop run.
2685,9738,7273.41,Deposit,2024-05-25,Wear game recognize already that law.
2686,9612,5974.12,Transfer,2021-12-29,Start society then.
2687,9697,5414.4,Refund,2025-05-08,Create trial condition.
2688,4524,359.47,Debit,2023-04-29,Buy authority party son begin to.
2689,6405,2262.06,Credit,2024-01-26,Sport analysis economy away ok room.
2690,179,9638.01,Transfer,2025-03-13,Media glass gas five side piece record.
2691,3155,3152.44,Credit,2021-10-19,People its low system.
2692,9510,1111.76,Withdrawal,2024-01-11,Customer traditional risk possible.
2693,954,4042.88,Refund,2020-12-10,Clear create skill necessary computer.
2694,1622,1532.39,Credit,2025-07-25,Until oil democratic body method modern agent.
2695,6853,2170.25,Debit,2024-08-04,Down nature forward Congress above.
2696,6934,7615.42,Withdrawal,2021-10-24,Produce federal add.
2697,3635,1656.24,Deposit,2020-08-30,Art card month matter risk pattern she.
2698,9123,4838.91,Debit,2025-01-12,Black return prevent movement report.
2699,4779,8117.4,Deposit,2023-05-26,Growth lot church trip life.
2700,774,2384.34,Transfer,2021-08-26,Meet exactly peace card contain catch law.
2701,5206,1248.47,Refund,2020-11-22,Choose writer I maybe huge factor.
2702,7560,8950.42,Deposit,2024-06-18,A everybody mission machine herself.
2703,8332,3715.76,Deposit,2022-03-07,Court detail music majority.
2704,6284,935.43,Credit,2022-09-29,Base area late fine.
2705,1918,925.43,Debit,2021-11-14,Media rich scene partner try seat particularly.
2706,6930,6332.71,Withdrawal,2023-10-16,Market third must station.
2707,701,8538.04,Credit,2022-10-25,Leader operation type.
2708,3332,9634.16,Debit,2023-04-22,Vote road stage knowledge.
2709,8795,4108.62,Deposit,2020-10-03,Loss management book value best space.
2710,3949,4782.01,Debit,2022-03-23,Father radio executive first.
2711,8926,6707.62,Withdrawal,2024-03-25,Its see although part Mrs information evening list.
2712,4093,3549.5,Deposit,2021-10-05,Party yard skill show management.
2713,7587,7484.56,Refund,2021-11-22,Person return difficult away score upon interesting.
2714,1195,3274.92,Deposit,2022-02-14,Security leave themselves once stand.
2715,3566,6144.83,Deposit,2023-09-11,Star process door simple.
2716,6062,5883.98,Debit,2020-09-25,Goal including represent.
2717,157,3766.18,Refund,2021-06-09,Everything somebody plan every yet card father peace.
2718,2636,994.58,Refund,2021-06-05,System positive though particularly.
2719,1031,7501.52,Refund,2022-04-05,President according paper nor election deal.
2720,2824,5976.35,Withdrawal,2024-02-16,Onto wind talk nor idea guy yes.
2721,7890,8668.53,Withdrawal,2024-12-18,Decision capital grow from about before.
2722,2239,5302.27,Withdrawal,2020-11-16,Technology central exactly focus result expert top.
2723,6906,5361.79,Debit,2022-05-17,Employee only treatment pressure pressure.
2724,8912,993.71,Debit,2022-09-10,Million situation dog need Republican sit society.
2725,274,2840.3,Refund,2022-02-13,And national task.
2726,9685,6899.44,Withdrawal,2024-01-06,Foreign seven close side near bad.
2727,9867,1348.73,Credit,2022-05-30,Consider certain approach.
2728,5127,6646.89,Refund,2022-01-13,Fact rock training different thus with.
2729,8869,9196.49,Deposit,2022-05-31,Project effort floor Mrs financial.
2730,2976,859.47,Debit,2020-09-21,Before catch begin even kind lot.
2731,3611,4437.83,Withdrawal,2021-09-01,Out color management deal serve give.
2732,6354,356.58,Refund,2024-12-14,Low himself discover capital consumer.
2733,3456,3216.64,Deposit,2023-10-07,Face detail image instead never Mr reduce close.
2734,3589,2234.65,Refund,2021-03-27,Matter ago difference else education oil.
2735,7579,2728.03,Withdrawal,2021-08-05,Which beyond smile whatever keep live cover.
2736,375,7414.16,Debit,2020-10-28,Election consider save discuss partner goal court.
2737,607,1900.96,Deposit,2021-02-13,Kitchen note modern ever plant.
2738,6308,1140.18,Withdrawal,2023-09-29,Nation foot during music receive offer.
2739,6517,424.14,Withdrawal,2025-04-23,Rule late task will require.
2740,7652,357.76,Refund,2023-05-05,Realize realize loss material imagine onto.
2741,897,4996.45,Refund,2022-07-12,Party force off beyond happy most.
2742,6123,6561.83,Withdrawal,2023-07-17,Idea yeah play need.
2743,1190,5994.83,Withdrawal,2022-08-17,Back above return provide without clearly outside.
2744,6067,8650.06,Debit,2022-11-06,Indicate push way until trip wide play.
2745,5064,7198.4,Refund,2025-03-19,Once side argue study nor.
2746,3988,9908.13,Debit,2022-06-29,Their type wide.
2747,2020,3759.36,Withdrawal,2022-10-31,Such wonder director between man picture.
2748,6693,9575.25,Deposit,2022-04-29,Either PM indicate middle.
2749,6560,8673.66,Refund,2024-01-14,Out create increase bring suffer song alone.
2750,4075,857.08,Debit,2025-01-21,Beat involve set buy interest billion situation.
2751,8686,1296.1,Debit,2021-01-24,A pattern space serious rise their cup.
2752,5989,8808.63,Withdrawal,2022-07-31,Beat watch rather travel consider than.
2753,6873,4253.83,Refund,2022-01-17,Exist two through fund behind contain such.
2754,4069,7176.5,Credit,2023-08-14,Tv nature card focus.
2755,3117,2973.03,Refund,2022-03-31,Record more federal carry statement when.
2756,2381,5655.12,Withdrawal,2021-02-10,Decision both growth huge good.
2757,6476,5744.57,Withdrawal,2025-05-08,Plan help season drug produce fish listen.
2758,7562,5168.76,Deposit,2022-09-09,Hospital blood way degree accept study.
2759,3582,2241.3,Deposit,2020-11-21,Now provide edge similar two which.
2760,5524,6151.6,Refund,2022-04-04,Major draw ability series anything hear lose.
2761,9616,4994.7,Debit,2022-10-13,Deal writer back into.
2762,2896,8624.55,Refund,2025-04-18,Space authority soldier think early build.
2763,2538,6373.23,Deposit,2025-04-30,Ball popular player theory method decide sea.
2764,4107,1533.75,Debit,2024-03-20,Live similar institution old than generation play.
2765,7834,1277.75,Deposit,2024-02-25,Heart inside back certain process serve.
2766,3242,8149.27,Refund,2020-08-19,Technology others appear Congress none throw.
2767,3644,598.88,Refund,2024-06-26,Entire machine throughout in significant man radio.
2768,8075,3737.91,Refund,2025-05-26,Blood executive represent instead she choose.
2769,768,639.78,Transfer,2022-01-29,Customer meet peace Democrat.
2770,99,2452.81,Withdrawal,2024-05-16,Improve against bed tend staff particularly.
2771,7424,3766.41,Deposit,2024-07-06,Popular option theory.
2772,2087,7963.93,Withdrawal,2022-12-18,Other run form through away film.
2773,9773,3777.99,Deposit,2021-09-05,Training scene according style media him establish away.
2774,7660,4108.23,Deposit,2022-06-13,Radio later specific chair.
2775,4011,8604.81,Credit,2024-02-10,Magazine mention show risk.
2776,9182,6320.24,Refund,2024-02-13,Left talk hot.
2777,7397,5401.56,Debit,2022-08-23,Material fear science money operation sometimes the.
2778,737,874.27,Debit,2023-12-11,Sound movement recognize radio rule up.
2779,512,5041.94,Refund,2022-01-26,View minute never dog line.
2780,8613,7568.0,Withdrawal,2024-06-11,Arm officer challenge question cut.
2781,3029,8609.2,Credit,2024-02-12,Window almost person best some.
2782,3708,6528.08,Deposit,2021-03-07,Cover less much capital remember far.
2783,6676,8909.62,Transfer,2021-09-23,Special by owner book majority hit fine would.
2784,8240,7919.08,Transfer,2021-04-30,Positive possible glass no like somebody she.
2785,6067,9312.16,Transfer,2025-01-18,Major physical surface bank hospital quality.
2786,1930,4630.79,Debit,2020-09-24,Property else down increase with issue.
2787,8462,1061.02,Withdrawal,2022-08-04,Discussion every age.
2788,5833,934.12,Withdrawal,2020-11-05,Son region vote choose not.
2789,2454,813.2,Deposit,2022-01-19,Use election game against happen.
2790,1485,4274.86,Withdrawal,2023-07-05,Morning TV process.
2791,364,4488.81,Debit,2023-12-05,Seem something next guess recognize rather order number.
2792,7017,5466.46,Deposit,2024-10-04,Deal near ok poor.
2793,294,7568.28,Deposit,2022-12-26,Public recently stand everybody.
2794,7088,5646.85,Refund,2022-08-12,Candidate time agreement standard garden analysis.
